split,ood_tag,method,threshold,score,true_label,pred_label,text
OOD,ood_csv_ood_data,maha,-9827.423779,-2545.586182,N/A,영양건강,"뉴질랜드 당뇨병협회장, 당세(sugar tax) 반대 뉴질랜드 당뇨병협회장은 가당 제품(sugary products)에 부과하는 세금이 당뇨병 확산을 막는 데 도움이 될 것이라는 주장들을 맹공격했음. 협회장은 한 당뇨병 인식 증진 캠페인에서 당(sugar)을 담배처럼 취급해서는 안 되며, 담배는 모든 사람의 일상생활에 존재하지 않는다고 말했음. 또한 비만을 다루는 것은 더 전체론적인 접근법이 필요하며, 이는 사람들이 더 나은 선택을 할 수 있게 하는 교육에 관한 것이어야 한다고 말했음. 협회장에 따르면, 25만 명의 뉴질랜드인이 당뇨병이 있으며, 현재의 비율로는 4명 중 1명이 당뇨병에 걸릴 위험이 있음. 작년 오타고 대학교의 한 연구에 의하면, 탄산음료에 부과하는 세금이 생명을 구하고 뉴질랜드의 건강 프로그램들에 수백만 달러의 세입을 발생시킬 수 있음. 연구는 탄산음료에 20%의 세금을 매길 시 에너지 섭취를 하루에 20kJ 감소시키며, 심혈관 질환, 당뇨병, 식이 관련 암으로 인한 사망을 일 년에 67건가량 방지하거나 늦추도록 도울 것이라고 추산했음. 하지만 존 키 총리는 지난달, 정부는 “지금(at the moment)” 당세를 부과하지 않을 것이라고 말했음."
OOD,ood_csv_ood_data,maha,-9827.423779,-2210.565430,N/A,안전위생,"[위생용품]미국 플로리다 항소법원, 코럴게이블즈의 스티로폼 용기 사용 금지령 거부해  미국 플로리다 소매 연맹(Florida Retail Federation)과 함께 주법을 지지하며, 항소 법원은 수요일 ‘코럴게이블즈(Coral Gables)’시의 스티로폼 식품 용기 사용을 금지하는 2016 조치를 거부함.  제 3차 항소법원의 3명의 판사 패널은 3개의 주법이 위헌인 것을 발견한 마이애미-데이드 카운티 순회 재판관의 판결을 뒤집으며, 코럴게이블즈가 스티로폼 금지령을 제정할 수 없다고 결정함.  동 사건은 2016년 3월 주 의원들이 통과시킨 농업 및 소비자 서비스 부의 법안에 중점을 두었음. 이 법안은 지방 정부가 식품 관련 폴리스티렌 (일반적으로 스티로폼) 용기를 규제하고 2016년 1월 1일 이후 통과된 지역 조례에 대해 이러한 금지를 소급하도록 함.  코럴게이블즈는 2016년 2월 스티로폼 금지 조례를 승인 했으며, 소매 연맹과 Super Progreso, Inc.(사)는 이후 합법성에 반하는 소송을 제기함. 마이애미-데이드 카운티 순회 재판관 ‘Jorge Cueto’는 2016년 주법(포장 규제를 다루는 두 가지 주법)이 위헌이며 코럴게이블즈의 조례를 뒷받침한다고 판결함. 그러나 항소법원은 수요일 그 판결을 거부함.  "
OOD,ood_csv_ood_data,maha,-9827.423779,-1608.156250,N/A,안전위생,"캐나다 식품검사청, 캐나다산 돼지고기 및 쇠고기 제품의 중국 수출 재개 발표해 캐나다 식품검사청(CFIA)은 2019년 11월 5일 이후 자국 내 적격한 시설에서 가공된 돼지고기와 쇠고기가 중국으로 수출될 수 있음을 발표했음. CFIA는 적격한 시설 모두에 대하여 돼지고기와 쇠고기 제품에 대한 중국용 수출증명서를 발급하기 시작할 것임."
OOD,ood_csv_ood_data,maha,-9827.423779,-5350.166016,N/A,영양건강,"미국 국회 표결로 영부인의 급식 사업에 차질  미국 미쉘 오바마 영부인이 내세운 학교 급식의 영양 기준 채택이 공화당의 지연 노력에 부딪혀 차질을 빚게 되었음. 오바마 영부인과 뜻을 모았던 민주당은 29일(현지시간), 농무부의 지출법안(1420억 달러)에서 공화당의 제안을 제외시키려 노력했지만 수포로 돌아갔다고 전했음. 지출법안은 세출위원회의 승인을 얻어 하원 본회의로 회부된 상태임.  로버트 애더홀트 하원의원이 지난 2010년 승인된 지방 제한 및 과채류, 통곡물 제공 증진에 관한 규정을 시행하는데 학교들이 재정적으로 어려움을 겪고 있으므로 유예기간을 늘리자는 계획을 내놓자 논란 거리로 떠올랐음.  애더홀트 의원은 세출위원회의 심의에서 어린이들에게 건강한 점심과 음식을 지원해야 한다는데 뜻을 명확히 같이 하지만 일선 학교에서 규정을 시행하는데 시간이 너무 촉박하다는게 핵심 문제이므로 학군에 시간을 더 주어야 한다고 말했음.  그러나, 애더홀트 의원의 의견을 법안에서 제외시키자던 민주당 소속의 샘 팔 의원의 개정안은 당론에 따라 반대 29표, 찬성 22표로 통과되지 못했음.  한편, 영부인은 법안과 관련해 민주당과 보건단체, 일반인들은 면제 조항을 비롯해 영양 제도를 수정하려는 어떠한 안건에도 맞써야 한다는 공식 입장을 밝힌 바 있음. 민주당 팔 의원은 면제 조항이 하원의 본회의에서 끝내 무산될 수도 있지 않겠냐는 의견을 보였음.  현재 상원에도 이와 유사한 법안이 상정되어 있지만 면제 조항은 포함되어 있지 않음. 따라서, 하원 표결에서 면제 조항이 살아남는다 하더라도 상원이 자체 발의 법안을 승인하게 되면 양원이 협의를 통해 해결하게 될 수도 있음. "
OOD,ood_csv_ood_data,maha,-9827.423779,-1124.683716,N/A,안전위생,"영국 식품기준청, 이사회 회의 안건 및 자료 공개  영국식품기준청(FSA)은 오는 11월 5일(현지시간)에 열릴 차기 공개 이사회의 안건 및 자료를 공개했음. 누구나 회의에 참석하거나 온라인 생중계를 통해 회의를 볼 수 있음. 회의 안건은 다음과 같음.  - 전략/정책 자료- '위험한' 식품에 대한 당국의 접근법- 식품기준청전략 2015-20- 말고기 사건에 이은 FSA 능력, 시스템 및 유대관계 강화에 관한 갱신"
OOD,ood_csv_ood_data,maha,-9827.423779,-8624.784180,N/A,표시광고,"미국 캘리포니아주, 올리브유 등급제 도입 고려 중 강력한 품질기준을 충실하게 지키지 않아도 되는 정부지원 유럽 생산자들에게 맞서기 위해 캘리포니아주는 지역 고유의 올리브유 품질 기준을 채택할지 고려하고 있음. 캘리포니아주 농식품부는 곧 올리브유의 순도와 품질에 대한 인증서 및 검사를 요구하게될 것으로 보임. ""가벼운(light)""와 ""순수한(Pure)"" 올리브유와 같은 일반적인 용어의 사용을 금지할 신규 법안도 선보일 것임. 이번 안은 캘리포니아주의 대규모 올리브 재배업자와 제분업자에게만 적용할 것이지만 이들은 유럽연합(EU)과 올리브유 수입 단체들의 비난을 받고 있음. 올리브유 수입 단체들은 거대한 통상 제약을 가져올 것이라고 보고 있음. 법안 지지자들은 정부의 지원을 받는 유럽 생산자들과 해당 분야에서 동등한 지위를 갖게 될 것이라고 전했음. 현재 미국에서 올리브유를 엄격하게 규제하는 연방법은 없으며 농무부는 엑스트라 버진 올리브유에 최고 등급에만 가능한 자발적 인증서만 발급하고 있음."
OOD,ood_csv_ood_data,maha,-9827.423779,-5047.850098,N/A,안전위생,"유럽식품안전청, 2014년 인수공통전염병 보고 및 데이터 수집 설명지침 발표 유럽식품안전청(EFSA)은 지침 2003/99/EC에 따라 유럽연합에서 인수공통전염병, 동물매개 감염 작용제, 가축의 수, 항생제내성균, 식품매개 질병에 대한 보고의 통합뿐 아니라 수집된 자료의 요약 및 분석 작업을 했음.여기에 EFSA는 회원국들이 XML/Excel/CSV를 이용한 자료제출을 지원하기 위해 구체적 사용지침을 마련했음. 이는 데이터 수집 체계(Data Collection Framework)를 통해  XML/Excel/CSV 데이터 전송을 위해 사용되는 EFSA 데이터 모델에 포함된 각각의 요소를 상세히 설명하기 위함임. "
OOD,ood_csv_ood_data,maha,-9827.423779,-3979.672119,N/A,안전위생,"미국 와이오밍주 주지사, 가정재배 식품의 판매 규제 완화 법안에 서명 미국 와이오밍주 매트 미드 주지사는 화요일(현지 시각) 와이오밍주 식품 자유법(Wyoming Food Freedom Act)에 서명을 마쳤음. 동 법은 가정에서 만들하거나 기른 상품을 판매하려는 소규모 농민이나 그 외 개인과 농산물 직판장에서 판매하는 데에 적용됨. 이는 검사, 면허취득 및 증명서와 같은 정부의 감시를 받지 않고 식품을 판매하도록 면제시켜주며, 생산업자와 이를 알고 있는 최종 소비자 사이에 이루어지는 단일 거래인 경우에도 면제 적용됨. 이 하원법안 56은 주 보건당국이 특히 미살균 낙농제품을 포함해 규제를 없애면 국민 안전에 문제점을 발생시킬 수 있다는 우려에도 불구하고, 하원의 만장일치(찬성 60표, 반대 0표)와 상원 가결(찬성 20표, 반대 8표)로 압도적인 지지를 받았음. "
OOD,ood_csv_ood_data,maha,-9827.423779,-3949.556152,N/A,안전위생,"EU 집행위, 생선 및 꿀 관련 식품사기 보고서 발간 유럽집행위원회 보건식품안전총국이 생선 및 꿀의 유통과 관련하여 발생한 식품 사기 평가를 목적으로한 범EU 통제 계획의 결과를 발표했음.  - 대상: 28개 회원국, 노르웨이, 스위스- 기간: 2015.06~11- 방법: 검체 채취 및 테스트 (harmonised) * 생선 바꿔치기에 관한 결과: http://ec.europa.eu/food/safety/official_controls/food_fraud/fish_substitution/tests/index_en.htm * 꿀 관련 사전 결과: http://ec.europa.eu/food/safety/official_controls/food_fraud/honey/tests/index_en.htm 이러한 통제 조치는 집행위가 식품 사기에 대항하기 위한 방안의 일환임. 같은 맥락에서 얼마 전 초국경적 식품법 위반 사건의 경우 회원국 기관 간 정보 교환을 위한 전용 IT툴(the Administrative Assistance and Cooperation system)이 가동되었음. "
OOD,ood_csv_ood_data,maha,-9827.423779,-3875.561035,N/A,물리적 위해요소,"뉴질랜드,  'Ingham's' 닭고기에서 검출된 이물 '닭고기'로 밝혀져  *관련 기수집정보- 뉴질랜드, 'Pak'n Save'에서 구입한 'Ingham's' 닭고기에서 구더기 검출되어 조사 중(수집일자: 2018-07-26) 뉴질랜드 타우리코 팩엔세이브(Tauriko Pak'nSave)와 잉햄(Ingham's)은 한 소비자가 자신이 요리하고 먹은 닭고기에서 구더기를 발견했다고 주장함.  조사 결과, 이물질이 곤충, 번데기 또는 애벌레가 아닌 것을 확인함.  푸드스터프 미디어(Foodstuffs media) 대변인은 ‘단순히 닭고기’라고 언급함. 식품 안전 및 생물학적 안전 서비스 AsureQuality는 잉햄을 대신하여 조사를 수행하였으며, 동 결과는 잉햄에 의해 소비자인 'Morris-Vette'에게 전달되었음."
OOD,ood_csv_ood_data,maha,-9827.423779,-4519.371582,N/A,생물학적 위해요소,"유럽식품안전청, 왕우렁(apple snail)이 환경에 미치는 영향에 대하여 왕우렁(Pomacea maculata, P.canaliculata)은 담수 복족류의 일종으로, 막대한 양의 쌀을 소비하며 천연 습지에 서식하는 동식물군을 위협하고 있음. 남아메리카가 원산지로 대만은 1980년대에 잠재적 식품 공급원으로 왕우렁을 도입했음. 이후 태국, 캄보디아, 중국, 필리핀, 일본 지역으로 빠르게 확산되었음. 2010년, 유럽 지역에서는 최초로 스페인 에브로(Ebro) 삼각주의 쌀 농지에서 관찰되었음. 당시 EU에는 왕우렁에 대한 규제가 마련되어 있지 않았음. 왕우렁은 근절 대책에도 불구하고 여전히 에브로 삼각주 지역에서 증식하고 있음. EFSA 식물보건패널의 Joop van Lenteren 부단장은 왕우렁의 증식 방식, EFSA의 평가 방식, 대응 조치 등을 설명함.  * 왕우렁이 환경에 미치는 영향에 대한 EFSA의 평가: http://www.efsa.europa.eu/en/efsajournal/pub/3487.htm"
OOD,ood_csv_ood_data,maha,-9827.423779,-9689.108398,N/A,안전위생,"영국 환경식품농촌부, 식품 폐기물 저감 위한 시범 계획 수립 영국 환경식품농촌부(DEFRA)는 식품 폐기물 저감을 위한 시범 계획(pilot scheme)을 수립 할것이라고 밝혔음. 동 계획은 식품 폐기물 처리를 위해 할당된 1500만 파운드의 추가 기금으로 지원될 것임. 현재 매년 약 43,000톤의 잉여 식품이 소매업체 및 식품 제조 업자로부터 재분배되고 있음. 이는 2억 5천만 번의 식사에 해당하는 양으로, 에너지 생산이나 동물 사료 등에 사용됨. 동 시범 계획은 앞으로 업체 및 자선 단체와 협력하여 개발될 것이며, 2019/20년도에 시작될 예정임."
OOD,ood_csv_ood_data,maha,-9827.423779,-1706.301270,N/A,안전위생,"미국, 2013년 4분기 식품회수 건수는 줄었지만 파급성은 커져 미국 'ExpertRECALL(* 각 제품 제조업체의 제품회수 절차 및 관리를 지원하는 업체)'에 따르면, 미국 식품의약품청(FDA)의 4분기 식품회수 건은 감소했지만 전국에 걸쳐 피해를 입은 소비자의 수는 두 배 이상 증가했다고 전함. FDA의 회수집행 보고서에는 2013년 4분기 137건으로 동일 연도 3분기 보다 47% 감소했음.2013년도 미국 전역의 3분기 회수건 중 12% 만이 소비자에게 영향을 주었지만 4분기에는 27%를 기록함. 4분기 총 회수 건이 약 50% 줄어든 것을 고려했을 때 소비자에게 영향력을 미친 건수가 27% 증가했다는 사실은 유념할만 함. * 회수 관리체제의 복잡성ExpertRECALL은 회수 관리체제의 복잡한 요인들이 건수별, 지리적 접근성, 피해를 입은 단위, 그리고 정치적 풍토의 변화와 같은 요인들을 측정할 수 없게 하고 있다고 언급했음. * 회수 식품 건수 증가2013년 4분기 회수식품은 동일 연도 3분기 대비 52%에 해당하는 1,060 만 개가 회수되었음. 미국 농무부(USDA)는 2013년 4분기에 19건의 회수가 있었다고 보고했지만 회수량은 2013년 첫 분기 대비 대략 2배 증가했다고 발표함. 다시 말해, 2013년 1분기에 450,000 파운드의 식품이 회수된 반면 마지막 4분기에는 860,000파운드로 치솟았음."
OOD,ood_csv_ood_data,maha,-9827.423779,-1757.510986,N/A,표시광고,"영국 스코틀랜드식품기준청, 젊은이들이 식품알레르기를 이야기하도록 응원하는 캠페인 시작 스코틀랜드식품기준청(Food Standards Scotland, FSS)의 설문조사에 응한 식품알레르기를 가진 응답자의 44%는 외식 때마다 항상 식품알레르기가 있다는 점을 말하지 않을 것이라고 함. 12-18세의 응답자는 (알레르기가 눈에 안 보일 경우) 소란을 피우고 싶지 않거나, 직원에게 말하는 것을 중요하다고 여기지 않거나, 부끄럽게 생각하기 때문을 이유로 듬. 식품 알레르기 인구의 40%는 구입하는 음식에 적힌 성분과 안전성을 항상 확인하지 않음. Allergy UK와 Young Scot의 후원을 받아 FSS가 2월27일에 시작한 이 캠페인은 젊은이들이 다른 사람들에게 식품 알레르기를 알리고, 선택한 음식이 안전한지 확인하기 위해 외식 시 라벨과 메뉴 확인의 중요성을 강조함. "
OOD,ood_csv_ood_data,maha,-9827.423779,-5104.479492,N/A,영양건강,"호주 소비자단체 초이스, 호주 소시지 비교 리뷰 발표 호주 소비자단체 초이스(Choice)는 'Woolworths', 'Coles', 'Aldi'에서 구입한 소시지에 대해 테스트를 진행하고 그 결과를 발표함. [리뷰 제품 정보('Woolworths', 'Coles', 'Aldi' 순)] - 개당 가격: 40c, 45c, 38c- 육류 비율(%): 73%, 70%, 71%- 지방 함량(100g 당): 21.8g, 16.8g, 21.4g- 나트륨 함량(100g 당): 580mg, 750mg, 634mg [리뷰 결과]'Woolworths'가 45%의 득표율을 기록하며 1위를 차지함.73%의 ""쇠고기 및/또는 양고기""로 이루어진 조합의 'Woolworths' 제품은 나트륨 함량이 가장 낮았지만 지방 함량이 가장 높았음. [소시지를 맛있게 요리하는 방법]1. 후드를 내린 상태에서 중간 불로 바비큐를 5분간 예열한다.2. 핫플레이트에 기름을 살짝 바른다.3. 후드가 닫힌 핫플레이트의 소시지를 양면이 진한 갈색이 될 때까지 조리한다.(두께에 따라 6~8분 정도)"
OOD,ood_csv_ood_data,maha,-9827.423779,-2244.944580,N/A,안전위생,"CODEX 아시아지역조정위원회, 10년 간의 인도 식품법 반추 및 강화 방안 논의  국제연합식량농업기구(FAO)와 세계보건기구(WHO) 공동 아시아지역조정위원회(CCASIA)가 9월 26~30일(현지 시간) 인도의 뉴델리에서 두번째 만남을 가졌음. 각 위원회는 식품 기준과 식품 관리에 대한 지역의 문제와 수요를 명확히 할 책임이 있음. 지역 수준에서 복합적으로 일을 해결하는 것을 통해서, 국가들은 식품 관리와 기반 시설 강화를 위해 식품 관리 관련 규정 사안과 문제점을 도출해낼 수 있음.2016-2017년 지역 회의의 새로운 사안들은 다음과 같음.-지역 특정 사안의 문제와 어려움을 강조하는 기조 연설-지역조정위원회의 절차를 통해 식품 안전 및 품질에서의 중요한 사안 도출-국가 식품 관리 시스템의 정보 교환을 위한 새로운 온라인 플랫폼 도입-국가 수준에서 국제식품규격위원회(CODEX)기준을 사용하는 정보 수집인도는  1977년 위원회가 회동하였을 때 첫 지역 조정자였으며 이번 2016년 회의는 인도 식품안전기준청(FSSAI)의 식품 안전 및 기준법 2006의 10주년과 겹쳤음.식품 안전 및 기준법 2006은 10개가 넘는 규정을 하나로 통합시킴으로서 인도가 식품 규정을 대하는 방식을 변화시켰음. 인도 식품안전기준청 대표는 ""불순물을 감지하고 범죄자를 처벌하는 것에서 자체 규제를 조장하고 과학을 기초로 한 기준을 장려하는 것으로 변화했다""고 밝혔음.식품안전기준청은 13,000조항이 넘는 기준을 제정했으며 식품 안전을 위한 184개의 주요 검사 실험실 설립 및 142개 수입 통로의 관리 체계를 설립했음.인도와 CODEX의 접점은 인도 보건가족부 내의 식품안전기준청에 의해 이루어졌음. 또한 상업, 농업, 식품 가공을 포함한 타 부처와 함께 기준 제정 및 CODEX에 관해 협업했음.식품안전기준청은 업계단체, 소비자단체, 전문가 및 과학자와 긴밀하게 일함. 식품사업관리자(FBO)는 안전한 식품 문화를 퍼뜨리기 위해 식품기준안전청의 프로그램에 참여하도록 장려됨. 기준법 10주년 기념 새로운 계획은 '안전한 식품 문화에 대한 시민의 자신감 키우기'였음. 해당 프로그램에는 가치사슬 전반의 식품 안전 훈련, 감시 활동 참여, 사업에서의 소비자 및 학교로 뻗어나가는 계획이 있음. 식품안전기준청은 '규정이 확실하면 식품 사업이 규정을 이행하기 위해 나설 것이다'라고 기대하고 있음.소비자들의 건강에 대한 관심이 높아짐에 따라 식품안전기준청은 집, 학교, 직장, 식당이나 노점에서도 '식품의 안전에 대해 사람들이 믿음과 자신감을 가질 수 있는 환경'을 가지게 하려고 노력 중임.회의는 이와 같은 것들은 국내 소 식품 사업부터 다국적 사업까지의 관리자들이 식품 기준 및 검사 체계가 튼튼하며 식품 안전 규정을 순응하도록 노력할 때 가능할 것이라고 밝혔음. "
OOD,ood_csv_ood_data,maha,-9827.423779,-6397.614258,N/A,영양건강,"미국 뉴욕 시의원, 식품정책자문위원회 창설 요구하는 법안 상정 미국 뉴욕시 의원 브래드 랜더(Brad Lander)와 벤 칼로스(Ben Kallos)는 14일(현지시간) 17명으로 구성된 식품정책자문위원회를 창설할 것을 요구하는 법안을 상정했음. 식품정책자문위원회는 뉴욕시 내 다섯 개 보로(borough)지역에서 재배된 식품을 들여오고 교내 급식체계를 관할하면서 비만율 증가에 대해 시장 드 블라시오(de Blasio)에게 자문을 주게 될 것임. 시장, 위원회대변인, 대중대변인, 5개 보로지역 대표, 시의회가 지명인을 지정할 것임."
OOD,ood_csv_ood_data,maha,-9827.423779,-4708.986816,N/A,안전위생,"미국, FDA 신임 청장에 친 제약업계 인물 스콧 고틀리브 지명 도널드 트럼프 미국 대통령이 식품의약품청(FDA)의 신임 국장으로 제약업계와 밀착관계를 맺어온 스콧 고틀리브를 지명했다고 백악관이 금요일(현지시간) 보도했음. 스콧 고틀리브 신임 국장은 조지 W. 부시 전 대통령 정부 시절 FDA 부국장을 지낸 바 있으며, 현재는 벤처캐피털 회사인 뉴 엔터프라이즈 어소시에이트(New Enterprise Associates)의 파트너임. 또한, 전세계 최대 제약회사 중 하나인 글락소스미스클라인(GlaxoSmithKline)을 비롯한 여러 제약업계의 고문 또는 다양한 이사직을 맡고 있음.  고틀리브는 트럼프 행정부의 후보 지명인 가운데 보다 적합한 인물로 여겨지지만, 진보 일각에서는 이번 지명에 대한 실망감을 여전히 표출하고 있음. 공공시민의 건강연구그룹의 마이클 카롬 국장은 트럼프 행정부의 지명인인 고들리브는 거대 제약업계와의 유착망이 전례없는 인물이라고 전하면서, 고들리브의 경력 대부분이 제약업계의 재정 이익 증진에 주력해 왔으며, 상원은 고들리브를 FDA 청장으로 인준해서는 안된다고 말했음. "
OOD,ood_csv_ood_data,maha,-9827.423779,-3908.768555,N/A,안전위생,"캐나다 보건부, 전통중국의약품 자문회의 참여 (식품형태의 전통중국의약품 논의) 캐나다 보건부 장관은 전통중국의약품(TCM) 자문회와 만나 캐나다에서의 전통중국의약품에 관해 이야기를 나누었음. 회의에서는 최근 전통중국의약품 제도를 비롯해 동물용 전통중국의약품, 식품형태로 수입, 판매되는 전통중국의약품(예: 인삼 및/또는 기타 전통중국의약품 허브를 함유한 음료)을 개괄적으로 다루었음.  자문회는 캐나다에서 새로이 뜨고 있는 각종 전통중국의약품 사안들에 대해  보건부에 자문을 전달하기 위해 지난 2012년 1월에 발족되었음. 자문회는 또한 제품 허가 신청과 라벨링에 대한 산업체 지침이 되어 줄 전통중국의약품 성분 모노그래프를 보건부가 작성하는데 도움을 주고 있음.  - 캐나다 보건부는 '천연보건제품규정'에 따라 전통중국의약품의 안전성, 효능, 품질을 감독하고 있음. - 자문회는 중국전통의약품에 관한 사안(예: 캐나다에서의 수입, 판매, 사용, 관행(지자체 관할), 신종 중국전통의약품 등)에 대해 보건부 장관에게 자문을 전달함. - 현재 캐나다에서 판매가 허가된 전통중국의약품은 3천 여개 이상임. "
