split,ood_tag,method,threshold,score,true_label,pred_label,text
OOD,ood_csv_ood_data,maha,-9827.423779,-3654.481201,N/A,안전위생,"캐나다 매니토바주, 보건부 인력 부족으로 식당 점검 일정 미뤄지고 있어 캐나다 매니토바주 보건 검사관 인력 부족으로 수천 개의 식당과 요양 시설 에 대한 점검이 미뤄지고 있음. CBC 뉴스는 날고기 취급, 취약계층 대상 서비스 제공, 규정 준수 문제 이력이 있는 업체 등의 고위험군 식당 시설들에 대한 검사 기한이 지난 사실에 대해 알게됨. 현재 검사를 기다리고 있는 고위험업소 355곳 중 2곳은 주민들이 식인성 질환에 취약한 개인요양시설임. 중위험 시설의 약 3분의 1에 대한 연간 점검과 마찬가지로, 특정 식당, 개인 요양원, 편의점을 포함하는 중위험 시설의 거의 절반이 2년에 한 번씩 검사를 받아야 함. 현재 2000개가 넘는 식품업소에는 검사관이 배정되지 않아 일반인들이 불만을 제기할 경우에만 정밀 조사를 받게 되는 실정임. "
OOD,ood_csv_ood_data,maha,-9827.423779,-7409.084961,N/A,생물학적 위해요소,"미국 육류연합-북미육류연구소, 북미육류연합으로 내년부터 합병 미국 육류연구소(AMI: American Meat Institute)와 북미육류연합(NAMA: North American Meat Association)이 내년 1월 1일부로 북미육류연구소(NAMI: North American Meat Institute)로 태어날 것임. 이는 식품안전을 포함한 모든 분야에 영향을 끼쳐온 두 개 식육업체기관을 하나로 모으는 것임.  2013년 양측 위원회 대표들이 2014년에 합병하는데 만장일치로 의견을 모은 가운데 올해 초 이들 기관의 합병 사실을 발표했음. NAMI 대표는 농무부 고위 관직에 몸담았던 베리 카펜터가 맡게 될 것임.  "
OOD,ood_csv_ood_data,maha,-9827.423779,-2301.802734,N/A,영양건강,"영국 건강 운동가들, 고기없는 버거류가 높은 소금 함유량을 숨기고 있다고 경고 영국에서 고기가 들어있지 않은 많은 햄버거가 권장 지침보다 훨씬 높은 수준의 소금을 함유하고 있다고 건강 운동가들이 경고하였음. 런던의 퀸메리대학(Queen Mary University)의 건강 전문가 그룹 ""Salt on Action""에 따르면, 고기가 들어있지 않은 햄버거가 ""건강한"" 대안으로 널리 알려져 있음에도 불구하고, 종종 실제 고기로 만든 것보다 더 많은 소금을 함유하고 있음. 전국 규모의 조사를 한 끝에 동 전문가 그룹은 쇠고기 햄버거의 평균 소금 함유량은 1인분당 0.75g으로 고기가 없는 햄버거의 평균 소금 함유량보다 0.14g 적은 것을 발견했음.또한 동 전문가들은 고기가 없는 제품(meat- free products) 157개를 포장제품을 분석하여, 고기가 없는 햄버거, 소시지 및 분쇄제품(mince)을 비롯한 많은 육류 대체품이 소금의 함유량을 ""숨기고 있다""는 결론을 내렸음. 이들은 PHE에 긴급 조치를 취하라고 요구하고 있음. 영국 정부는 영국에서 성인 및 어린이가 하루에 소금을 6g 넘게 섭취하지 않도록 권고하고 있음. 영국 공중보건국(PHE)의 영양학 책임자는 정부가 전국적으로 소금 섭취를 줄이도록 하겠다는 견해를 밝혔음. 그는 영국의 소금섭취량은 지난 10년 동안 줄었지만, 아직까지는 몇몇 식품이 너무 많은 소금을 함유하고 있기 때문에 갈 길이 멀다고 전하였음.영국 공중보건국(PHE)은 소금 감소 문제를 맡은 후, 업계의 진척상황에 대한 자료를 수집해왔으며 올해 말에 계획대로 이를 보고 할 것이라고 밝혔음."
OOD,ood_csv_ood_data,maha,-9827.423779,-8702.530273,N/A,안전위생,"초등학생 수 십명 이상 증상 호소, 급식에 나온 회수 대상 식품이 원인으로 지목 미국 텍사스주 남동부의 초등학교 3곳에서 점심 급식을 먹은 어린이 수 십명이 이상 증상을 호소했음. 학교 당국은 이번 사건이 회수된 쌀 때문으로 보고 있음. 학교측은 학교 카페테리아에서 점심을 먹은 직후 아픔을 호소하는 아이들이 봇물처럼 터져나왔다고 설명했음. 아이들은 주로 호흡 곤란, 발진, 가려움, 발열 증세를 보였음.  지역 당국은 이번 사건이 학교 급식에서 제공된 엉클 벤(Uncle Ben)의 멕시코 쌀(Mexican Rice)을 원인으로 지목했음. 당국은 알레르기 반응을 보인 어린이를 50명으로 집계했음. 학교 당국은 인터넷을 검색한 결과, 해당 쌀 제조사가 납품 한 달 전, 제품을 자진 회수한 사실을 확인했다고 전했음. 현재 사건 발생과 과실 책임을 조사하고 있음. "
OOD,ood_csv_ood_data,maha,-9827.423779,-7926.984375,N/A,안전위생,"미국 보충제업계, 뉴욕 법무부장관의 DNA 검사 조롱 DNA 바코딩(DNA barcoding)은 진짜 젖소 우유로 만든 고가의 ""양 우유""라고 판매된 저가 메기같은 몇몇 악명 높은 식품 사기를 밝혀왔음.  DNA 바코팅이 혈기를 높여준다고 과대 선전된 알약에 인삼이 들어 있는지, 아니면, 쌀과 솔 혼합물이 들어있는지를 가려낼 수 있을지에 대해 몇몇 과학자들은 그렇다고 답함. 반면, 산업 단체와 몇몇 독자적인 전문가들은 DNA 검사 하나만으로는 잎에서 알약이 되기까지 수 많은 가공단계를 거친 식물원료 제품을 분석하는 것이 부적합하다고 전함. 2013년 캐나다 정부의 연구에 따르면, 미국인 1억 5천만명 이상이 섭취하는 65,000 개 식이 보충제가 현재 시판되고 있다고 함. 미국 약용식물협의회(ABC·American Botanical Council)는 같은 해 미국에서의 허브 보충제 판매량이 60억 달러에 다다랐다고 추정함. 미 식품의약품청(FDA)은 업체에게 업체가 생산하는 제품이 안전하고 적절하게 표시되었는지를 검증하도록 요구하고 있지만, 식이보충제는 FDA의 처방 의약품 관한 엄격한 허가 절차에서 제외되고 있음. 뉴욕주 법무장관 에릭 슈나이더만은 오염된 식이 보충제가 원인인 것으로 밝혀진 2013년의 사건과 효모균 오염이 원인으로 밝혀진 의사가 제공한 프로바이오틱 보충제로 사망한 코네티컷 주의 영아를 언급하면서, 식이 보충제에 대한 느슨한 감시가 국민건강에 심각한 영향을 줄 수 있다고 전함. 지난 주, 슈나이더만 법무장관은 월마트(Wal-Mart), 월그린(Walgreen's), 타겟(Target) 그리고 GNC에 DNA 검사에서 의문점이 발견된 이들 업체 브랜드의 허브 보충제를 판매 중단하도록 요구했음.  법무장관은 장관이 의뢰한 클라크슨 대학교 연구와 퀄프 대학교 연구진이 2013년에 발표한 내용을 참고하여 이 같은 조치를 취했음. 클라크슨 대학교는 기억상실에서부터 전립선 이상에 이르는 모든 치료용으로 판매된 상점 브랜드 허브 보충제 100병을 검사한 결과 5개 중 4개에서 라벨에 표시된 허브류가 전혀 포함되지 않은 것을 발견함. 퀄프 대학교 연구진은 DNA 지문분석법(DNA fingerprinting)을 통해 44개 식이보충제 중 1/3에 라벨에 표시된 식물성분이 미량도 함유되어 있지 않다는 점을 발견함. 하지만 식이보충제 업계는 DNA 검사에 이의를 제기하고 있으며, 일부 소비자 단체는 검사법 자체만으로는 식이보충제에 가장 심각한 문제(중금속 오염 또는 화학적 오염물질)를 검출해낼 수 없다고 말하고 있음. 미국 천연제품공급협회는 슈나이더만 법무장관이 언급한 식이보충제를 미국에서 대량 구매하도록 사람들을 보내어 인증을 받은 식물 검사 연구실 대 여섯 곳으로 분석의뢰를 할 예정이라고 전함. 미국 약용식물협의회 이사는 이들 제품이 추출물이라면 DNA는 추출과정 중에 대개 소멸되기 때문에 DNA 검사법이 허브 추출물을 확인하는데 적합하지 않다고 전했음. 그는 법무장관이 언급한 제품 중 적어도 일부는 추출물로 만들어졌을 것이라고 언급했음."
OOD,ood_csv_ood_data,maha,-9827.423779,-983.575806,N/A,안전위생,"영국 식품기준청, 이사회 회의 안건 및 자료 공개 영국식품안전청(FSA)은 3월 25일(수요일)에 열린 이사회 회의의 안건 및 자료를 공개했음.  회의 안건은 다음과 같음. - 2015-2020 FSA 전략 계획- FSA 과학부의 미래 전략- 식품위생등급제(FHRS) 현황 및 차후 단계- FSA 회계감사리스크대응위원회(Audit and Risk Assurance Committee)- 계승발전위원회(Succession and Development Committee) 연간 보고서 팟캐스트- FSA의 공개이사회는 팟캐스트로도 볼 수 있음. 팟캐스트 버전은 3월 27일부터 공개됨."
OOD,ood_csv_ood_data,maha,-9827.423779,-7287.563477,N/A,표시광고,"뉴질랜드 일차산업부, 불닭 라면 회수할 필요 없다고 밝혀 오늘 뉴질랜드 일차산업부 식품안전국(NZFS)은 성명을 통해 Samyang Foods'(사)의 불닭라면 제품에 높은 수준의 캡사이신이 함유되었지만, 회수를 개시할 필요는 없다고 밝혔음. 관련 제품은 Buldak Hot Chicken Stew(Scoville rating: 4,705), Buldak 2x Spicy Hot Chicken(Scoville rating: 8,808) 및 Buldak 3x Spicy Hot Chicken(Scoville rating: 13,200)임.  NZFS Vincent Arbuckle 부국장은 ""NZFS는 동 제품에 높은 수준의 캡사이신이 함유된 것을 확인했으나 제품의 강한 매운맛이 명확히 표시되어 있다""라고 말했으며 ""동 제품에는 덴마크에서 진행된 회수의 근거였던 허약한 노인 및 어린이에 대한 위험이 존재하지만, 그들은 의도된 소비자가 아니다""라고 덧붙였음. 또한 Arbuckle 부국장은 ""소비자들은 동 제품이 본인들이 감당하기에 너무 맵다는 것을 파악할 수 있으며 자연스럽게 섭취를 중단할 것이다""라고 말했으며 ""식품 안전 위험이 있다고 판단되면 공공 안전을 위해 관련 제품 회수를 포함한 신속한 조치를 취할 것이나 동 사례에 대해서는 식품 안전 또는 적합성과 관련된 문제는 없다""라고 밝혔음. 추가적으로, Arbuckle 부국장은 현재까지 동 제품과 관련된 민원 및 부작용 사례는 없었다고 밝혔음."
OOD,ood_csv_ood_data,maha,-9827.423779,-9314.355469,N/A,안전위생,"미국 동북유기농업협회, 농민들을 위한 유기농인증 교육과정 제공 뉴저지의 유기농식품과 유기농업을 지원하는 비영리기관인 동북유기농업협회(뉴저지, NOFA-NJ)는 농민들에게 '로드 투 설티피케이션(Road to Certification)'이라 불리는 유기농 인증 절차를 엿볼 수 있는 교과과정 3가지를 제공함. 유기농업 종사자, 유기농 감시원, 공인 인증기관의 프레젠테이션을 포함하여 참가자들은 업계 전문가들과 함께 유기농 인증에 대해 살펴볼 기회를 갖게 될 것임. NOFA-NJ의 카밀 밀러 이사는 이번 교과과정에 대해서 수많은 요구가 쏟아지고 있는데 마침내 이를 성사시키게 된데 기쁨을 표했음. 그는 인증을 받는다는게 무엇인지, 어떻게 해야 하는 것인지, 가치가 있는지 아닌지 등에 관한 수 많은 질의사항이 있다면서, 이번 수업을 통해 인증 절차에 대해 진정으로 농민들이 습득할 수 있는 기회를 제공하게될 것이라고 전했음. 참가자들은 관련 규정에 관한 개요를 포함한 유기농인증제, 유기농 체계계획에 관한 심도있는 전망, 단계별 절차에 관한 개요, 검사에서 인증제로의 전환에 관한 안내를 받게 될 것임. 이는 인증제에 대한 농민들의 방향을 마련하고 각 단계별로 농민들이 이를 준비하는데 도움을 주기 위해 마련되었음. 유기농 인증제는 농민들에게 시장에서의 가격 보장과 인기 있는 소비자 보장과 같은 구체적인 장점을 제공하지만, 인증제에서 요구하는 관리시간 증가와 기록보관이 다소 장애가 될 수 있음. NOFA-NJ의 농업운영 대표인 저스틴 쿡은 이번 교과과정이 관심있는 농민들이 그들의 시간과 돈을 절약할 수 있는 올바른 착수를 이루어내는데 도움이 되기를 기대한다고 전했음."
OOD,ood_csv_ood_data,maha,-9827.423779,-7494.891113,N/A,안전위생,"[위생용품]스코틀랜드 정부 건물에서 일회용 커피컵 금지 스코틀랜드 정부는 플라스틱으로 인한 오염을 줄이기 위해 일회용 커피컵을 금지함. 6월 4일부터 뜨거운 음료는 재사용 가능 머그잔으로만 제공될 것임. 이번 조치는 매년 450,000개의 컵이 버려지는 것을 방지할 것으로 기대됨. 음료는 재사용 가능한 도자기 머그잔에 담겨 제공될 예정이며, 직원들에게는 테이크아웃용 컵 휴대를 장려함. "
OOD,ood_csv_ood_data,maha,-9827.423779,-3771.685547,N/A,안전위생,"[위생용품]뉴질랜드 환경부, 2025년 7월부터 일회용 비닐봉지 등 6가지 일회용 플라스틱 단계적으로 폐지  뉴질랜드 환경부 장관 David Parker는 발표를 통해 2025년 7월까지 비닐봉지 등 여섯 가지의 일회용 플라스틱 제품을 단계적으로 폐지하겠다고 밝혔음. 폐지되는 플라스틱 제품은 PVC와 폴리스티렌(polystyrene)으로 된 재활용이 힘든 식품 및 음료 포장재, 몇몇 분해 가능한 플라스틱 제품(광분해성 및 옥소분해성(oxodegradable)), 음료 젓개(drink stirrers), 면봉, 일회용 제품 봉지, 커틀러리(cutlery), 접시 및 사발, 빨대와 과일 라벨 등을 포함한 일회용 플라스틱 품목임. 플라스틱의 단계적 폐지는 2008년 폐기물 최소화 법(the Waste Minimisation Act 2008)의 섹션 23(1)(b)에 따라 2022년 10월부터 3단계로 진행될 것임. 2022년 말까지 PVC 육류 트레이(tray). 폴리스티렌 포장재, EPS 식료품 포장재, 분해 가능한 플라스틱 제품(광분해성 및 옥소분해성), 플라스틱 음료 젓개 및 플라스틱 기둥으로 만들어진 면봉이 폐지될 것임. 2023년 중반까지 일회용 비닐봉지, 플라스틱 식기류(접시/용기/커틀러리), 플라스틱 빨대 및 비료로 사용하지 못하는(non-compostable) 제품 라벨 등이 폐지됨. 2025년 중반까지 모든 PVC 및 폴리스티렌 식품 및 음료 포장재가 폐지됨. 한편, 일회용 컵 및 차가운 물품을 운반하거나 큰 물품을 보호하는데 사용되는 특정 유형의 발포 폴리스티렌에 대한 추가 논의가 필요할 것임."
OOD,ood_csv_ood_data,maha,-9827.423779,-7535.750488,N/A,표시광고,"헝가리 농업부, 동일 식품 브랜드 제품의 국가별 품질 이중 기준 문제 제기 헝가리 농업부는 슬로바키아와 함께 일부 동유럽과 서유럽 회사들이 동일 브랜드 상표를 부착한 채 품질이 낮은 제품을 다른나라에 판매하는 등의 ""품질에 대한 이중기준""을 없애기 위해 집행위에 문제를 제기할 것이라고 밝혔음. 또한, 체코, 헝가리, 폴란드, 슬로바키아 4개국이 빠른 시일 내에 동 문제에 대한 회의를 열어야 한다는 슬로바키아의 제안에 환영 입장을 보였음. 중앙유럽국가들은 EU시장에서 동일한 브랜드로 판매되는 제품 일부에 낮은 품질의 원료를 사용하는 것을 금지토록 EU에 촉구하고 있으나, 이는 포장에 성분이 표시되어 있는 한 합법적임."
OOD,ood_csv_ood_data,maha,-9827.423779,-1203.692139,N/A,안전위생,"영국 식품기준청, 이사회 안건 및 자료 공개  영국 식품기준청(FSA)은 오는 2014년 1월 21일 런던에서 개최되 공개 이사회의 안건과 자료를 공개했음. 이번 이사회 안건은 다음과 같음. - 육종을 표시하지 않은 육가공품의 오염 기준(threshold) 설정- 말고기 사후 검토 및 조치 계획 업데이트 - 소비자 참여 : 소비자와의 소통법 - 영국 내 FSA 승인 식육 시설의 감사 방법 검토 - 지속적인 거버넌스 검토 개선 : 열린 FSA를 향해 "
OOD,ood_csv_ood_data,maha,-9827.423779,-5908.489746,N/A,안전위생,"미국 의원, FDA에 소비자와 업체에 혼란을 주는 지침 초안 사용 중단할 것 요구 미국 의원들은 식품의약품청(FDA) 청장 마가렛 햄버그(Margaret Hamberg)에게 ""실질적 정책 개정""을 위한 지침 초안의 사용에 관한 우려를 담은 서안을 보냈음. 지침 초안이 법적 구속력이 없음에도, 이로 인해 수많은 소송건에 휩싸인 몇몇 식품업계들이 생겨나 의원들은 이에 관한 우려를 갖기 시작했음. 그 예로는 '탈수사탕수수즙(evaporated cane juice, ECJ)' 소송을 들 수 있음. 최근 FDA의 ECJ에 관한 언급에서 초바니(Chobani)와 에이미 키친(Amy's Kitchen)을 포함한 식품업계연합은 ""각각의 소송은 부정확하게 FDA의 최종 입장을 반영하고 있다면서 ECJ에 관한 지침초안(2009)에 지나치게 의존하고 있다.""고 언급했음. 부분 경화유를 저감화하기 위한 최근 FDA의 안에 영향을 받은 업체들은 규제당국이 행정절차법에 따라 공식적인 규칙제정절차를 거치는 대신 '잠정적인 결정'을 통해 규제하는 것을 항의했음. 많은 업체들은 마치 초안이 최종규정인것 처럼 여기고 이를 따라야 하는 것처럼 느끼고 있음.청장에게 보내는 서안에는 지침 초안이 점점 FDA 정책과 입장 과실이 되어가고 있다고 주장함.아무리 ""의견수렴을 받기 위해"" 발표되었다 하더라도 완성된 지침이 없이는 초안이 주요 사안에 대한 당국의 입장을 담고 있어 그 결과, 많은 업체들은 ""마치 초안이 최종규정인 것처럼"" 여기고 이를 따라야 하는 것처럼 느끼고 있다고 밝혔음."
OOD,ood_csv_ood_data,maha,-9827.423779,-8865.238281,N/A,안전위생,"영국 환경식품농촌부장관, 식품 폐기물 저감 위한 정부 노력에 동참할 것을 독려 (*)기제공정보: 영국 환경식품농촌부장관, 식품 폐기물 저감 위한 정부 노력에 동참할 것을 독려(2019-05-14) 관련 영국의 모든 주요 슈퍼마켓을 포함한 식품 업계에서 가장 큰 100개 이상의 주요업체들이 정부의 조치 촉구에 따라 음식물 쓰레기를 줄이기 위한 획기적인 조치를 취하겠다는 서약서에 서명했음. Aldi, Asda, Caffé Nero, Co-op, Costa, FDF, Lidl, Sainsbury 's, Starbucks, Tesco, M  S, Morrisons, Nestlé, Ocado, UKHospitality, Unilever, World Wildlife Fund for Nature 및 Waitrose는 2030년까지 음식물 쓰레기를 반으로 줄이겠다는 공약에 서명하고 행동 주간을 통해 이 문제에 대한 대중의 인식을 높이고 있음. 현재 영국에서는 농장를 떠난 후 연간 약 1020만 톤의 식량과 음료가 낭비되며 약 200억 파운드 상당의 가치가 있는 것으로 나타남. 영국 가정 주부는 먹을 수 있었지만 폐기 될 수 있는 식량에 매년 150억 파운드를 쏟아 붓고, 평균 가구당 연간 500파운드에 해당하는 것으로 추산됨 .환경부 장관 마이클 고브(Michael Gove)는 ""많은 영국 식품 업체들이 음식물 쓰레기를 줄이기 위해 판을을 바꾸는 작업에 전념하게 되어 매우 기쁘며,...중략...함께 음식물 쓰레기라는 환경 및 경제적 스캔들을 종식시킬 것""이라고 전함. 마이클 고브 환경부 장관은 식량 낭비를 줄이기위해 6백만 파운드 이상의 자금 지원을 신청한 바 있음."
OOD,ood_csv_ood_data,maha,-9827.423779,-6308.015137,N/A,안전위생,"[위생용품]미국 호놀룰루시, 플라스틱 식기& 스티로폼 용기 등에 대한 금지 법안 발의 움직임 미국 호놀룰루시의회는 일회용 플라스틱 기구 및 봉지 금지를 검토하고 있음. 만일 동 법안이 채택되면 금지령은 1월 초에 발효될 수 있음. 호놀룰루시의회에서 새로운 금지령이 승인되면, 스티로폼 용기에 점심을 먹고 플라스틱 빨대에서 소다를 마시는 것이 곧 과거의 일이 될 수 있음. 시의원 'Joey Manahan'이 동 법안을 소개했으며, 그는 환경을 오염시키는 플라스틱의 문제가 동 법안을 만든 이유 중 하나라고 설명했음.금지에는 스티로폼 용기, 포크, 수저, 칼, 빨대 및 일부 비닐봉지를 포함한 일회용 플라스틱 기구를 포함됨.과거에도 스티로폼과 플라스틱을 금지하려는 시도가 있었으나 실패한 바 있음.동 법안은 8월 말에 공공안전위원회에서 다뤄질 예정이며, 다시 9월에 다시 전체 심의회로 넘어갈 예정임. 통과될 경우, 2020년 1월에 적용될 수 있음."
OOD,ood_csv_ood_data,maha,-9827.423779,-6905.327148,N/A,안전위생,"캐나다 오타와市, 소형 양조장 폐점은 주류법 탓  캐나다 오타와市에서 소형 양조장 '비욘드 더 페일(Beyound the Pale)'을 운영 중인 사장은 온타리오주의 주류법 탓에 타 지역에서 새로운 생산 시설 부지에 매장을 하나 더 열면서 힌톤부르크에 있던 매장을 폐점시킬 수 밖에 없었다고 설명했음. 이 업체는 2015년 초쯤 오타와시에 새로운 소매점을 내려던 참이었음.  온타리오주의 현행 규정상 한해 250만 리터 미만을 생산하는 양조장은 분점을 낼 수 없도록 하고 있는데, '비욘드 더 페일'은 연간 생산량이 21만 6천리터였지만 분점 생산량은 요건에 턱없이 모자란 150만 리터였음.  '비욘드 더 페일' 사장은 ""구식 법률이라며, 정부가 지역 기업가들의 희생시켜 대형 다국적 기업의 이익을 보호하려는 정부가 우습다""다고 말했음. 온타리오주 주류도박위원회는 이를 법률을 현대화하기 위해 주류법을 검토해오고 있음. 생산요건을 낮추거나 전면 철회하는 방법, 제조업체들에게 규모에 상관없이 매장을 세 곳까지 열 수 있도록 허가하는 등 각종 방안들을 수렴했지만 법을 갱신하게 될 지 여부는 확인된 바가 없음. "
OOD,ood_csv_ood_data,maha,-9827.423779,-4250.861328,N/A,화학적 위해요소,"유럽의회, 미세플라스틱: 출처, 영향 및 해결책 미세플라스틱은 일반적으로 5mm 미만의 작은 플라스틱 조각을 말하며, 그 출처에 따라 2개 유형으로 나눌 수 있음. [1차 플라스틱]- 작은 입자로 환경에 직접 방출됨- 해양 내 미세플라스틱의 15~31%를 차지하는 것으로 추정됨- 주요 출처: 합성 의류 세탁(1차 플라스틱의 35%), 운전에 의한 타이어 마모(28%), 마이크로비즈 등 개인위생용품에 의도적으로 첨가되는 미세플라스틱(2%) [2차 플라스틱]- 큰 플라스틱 제품(예: 비닐봉지, 병, 고기잡이 그물 등)이 분해되면서 발생- 해양 내 미세플라스틱의 69~81%로 추정됨 바다에서 발견되는 미세플라스틱은 해양 동물들이 섭취할 수 있음. 이러한 플라스틱이 축적되면서 식품 체인을 통해 사람에게 전달될 수 있음. 미세플라스틱은 맥주, 꿀, 수돗물을 포함해 식품 및 음료에서도 발견되었으며, 최근에는 사람의 대장에서도 확인되었음. 사람의 건강에 미치는 영향은 아직 알려지지 않았지만, 플라스틱은 사람 및 동물이 섭취했을 때 해로울 수 있는 첨가물(예: 안정제, 난연제)이나 기타 독성 화학물질 등을 포함하고 있을 수 있음.  이에 따라, 2018년 9월 유럽의회의원(MEPs)들은 EU 내 플라스틱 폐기물의 재활용률을 높이기 위한 플라스틱 전략을 승인했음. 또한, 유럽집행위원회에 EU 전역에 의도적으로 첨가하는 미세플라스틱 금지 조치 도입과 섬유, 타이어, 페인트 등에서 방출되는 미세플라스틱 최소화를 위한 조치를 촉구함. 2018년 10월, 의회는 대체 가능한 특정 일회용 플라스틱 제품의 금지를 지지하였음. 또한, 금지 목록에 옥소-분해성 플라스틱도 추가하였음. * 유럽집행위원회 웹페이지(미세플라스틱 오염 관련): https://ec.europa.eu/research/sam/index.cfm?pg=pollution"
