id,질문,정답,top1 문서
260,캐나다 보건부가 경고한 해외 불법 식이보충제는 어떤 성분을 포함하고 있나요?,"캐나다 보건부가 경고한 해외 불법 식이보충제는 타다라필, 실데나필, N-데스메틸 타다라필, 레보도파, 노르타다라필, 데스카르본실데나필, 호모실데나필 등의 성분을 포함하고 있습니다.","캐나다, 해외 불법 식이보충제 8종 경고 (출처: 미국, 싱가포르)  캐나다 보건부는 해외 규제기관에서 의약품 성분 미표시로 적발한 해외 보건 제품을 안내함. 이들 제품은 캐나다 내 판매가 허가되지 않았으며, 시중 유통 정황이 없으나 여행객이 소지해 들여오거나 인터넷으로 구매했을 가능성이 있음. (* 제품 사진은 원문을 참조)[미승인 성기능강화제]1) One More Knight 1750, 타다라필, 다폭세틴, 미국 식품의약품청(FDA)2) Love4Long, 실데나필, 미국 식품의약품청(FDA)[미승인 체중감량제]1) Natural Eruption, 시부트라민, 미국 식품의약품청(FDA)[기타 미승인 제품]1) Kopi Jantan Tradisional Natural Herbs Coffee, 데스메틸 카보데나필, 미국 식품의약품청(FDA)2) DHZC-2 Tablet, 납 과다, 미국 식품의약품청(FDA)3) Snake Powder Capsules, 덱사메타손, 클로람페니콜, 클로르페니라민, 이부프로펜, 테트라사이클린, 싱가포르 보건과학청(HSA)4) JC Gold (덱사메타손, 데클로페니라민, 푸로세미드, 싱가포르 보건과학청(HSA)5) Tu Cho Pan Chi Pain (덱사메타손, 클로르페니라민, 푸로세미드, 싱가포르 보건과학청(HSA)"
261,미국 환경실무단과 노스이스턴대학교가 발표한 자료에 따르면 과불화합물이 검출된 공공급수시설은 몇 곳인가?,162개 공공급수시설에서 검출되었음.,"미국 환경실무단, 국내 과불화탄소 오염 지역 지도 공개 미국 환경실무단(EWG)과 노스이스턴대학교가 발표한 분석자료와 지도(*)에 따르면, 최근 환경보호청(EPA)의 시험에서 과불화옥탄산(PFOA)과 과불화옥탄술폰산(PFOS)이 포함된 화합물 계통인 과불화합물(PFCs)이 국내 162개 공공급수시설에서 검출되었음. 과불화합물(PFCs)은 들러붙지 않는 조리기구, 세척제, 방수의류 등 광범위한 소비재에 수년간 사용되어 왔고, 암과 발달문제, 면역체계 약화와 같은 많은 건강문제와도 관련되어 왔음. 제조사들은 제품에 더 이상 과불화합물을 사용하지 않고 있다 주장하지만 이번 분석자료의 공동저자인 환경실무단의 빌 워커씨는 미국인 98%의 혈중에 과불화합물 일부가 존재한다는 미국 질병통제예방센터(CDC) 검사결과를 토대로, 과불화합물이 오랜 시간 곳곳에 존재함이 입증됐다고 밝혔음. 과불화합물의 노출에 관련된 건강 리스크가 점점 인지되고 있음에도 불구하고 연방차원에서는 납이나 비소 같은 물의 오염물질로 규제되고 있지 않음. 환경보호청(EPA)은 과불화합물의 잠재적 위협을 인지하고 2012년 청의 ‘음용수의 비규제대상 오염물질 규칙(Unmonitored Contaminant Watering Rule)에 과불화합물을 후보물질로 등재해 2013년 검사를 시작함. 만 명 이상에 공급되는 모든 급수시설은 동 규칙에 등재된 비규제 오염물질을 의무 검사해야함. 과불화합물의 경우 과불화옥탄산(PFOA)이 20 ppt, 과불화옥탄술폰산(PFOS)이 40 ppt를 초과 검출되면 이를 보고해야함. 미네소타와 버몬트 같은 일부 지역에서는 과불화합물에 대한 우려로 보다 낮은 자체 기준을 설정하기도 했음. 과불화합물에 오염되었거나 의심되는 지역은 47곳으로 나타났으며, 그 가운데 21곳이 군부대, 20곳은 산업공장, 7곳은 민간 소방 지역이었음. (*)http://www.ewg.org/research/mapping-contamination-crisis"
262,미국 공익과학센터가 맥도날드에 중단을 촉구한 첨가물은 무엇인가?,"보존료 BHA, 합성 감미료 아스파탐, 적색 40호와 같은 합성색소","미국 공익과학센터, ""건강해진 맥너겟?"" 27일, 28일 양일간 보도된 뉴스가 마치 맥도날드는 인공 보존료를 사용하지 않은 '깨끗해진', '건강해진', '단순해진' 치킨 맥너겟을 일부 지역에서 시범 판매하겠다는 것으로 비쳐짐. 그러나 맥너겟의 수많은 원료들을 실제 사용하지 않을지 또는 얼마나 중요한 문제로 다룰지는 분명하지 않음.  맥너겟에 사용되는 보존료인 구연산은 이미 공익과학센터가 매우 안전한 것으로 분류한 바 있음. 언론 보도에서 다룬 또 다른 보존료는 터셔리부틸히드로퀴논(TBHQ)임. 맥너겟에는 없지만 튀김유에 사용되는 원료로, 맥도날드가 맥너겟만 언급하고 있는 실태에 문제가 있음. 센터는 터셔리부틸히드로퀴논이 래트의 종양 발생이 증가시켰다는 한 정부 주도 연구를 들어, 소비자들에게 해당 물질을 피해야 한다고 권고했었음.  센터는, 맥도날드가 맥너겟 전체 원재료명을 밝히지 않고 있다면서 언론 보도 내용보다 축약될 수 있다고 말했음. 맥도날드가 나트륨 함량을 절반으로 줄인다 해도 제품이 건강해졌다는 주장을 정당화할 수 있다고 설명했음."
263,스코틀랜드 식품기준청이 피프로닐과 관련하여 추가로 회수한 제품은 몇 개인가?,4개 제품이 추가로 회수되었음.,"스코틀랜드 식품기준청, 달걀 중 피프로닐에 관한 업데이트(9.7)(회수 정보 포함) 스코틀랜드 식품기준청(FSS)은 금일(9.7) 피프로닐 조사와 관련해 시장에서 회수된 제품 목록을 업데이트했음. 26개 제품이 추가로 회수되었으나, FSS에 따르면 해당 제품들은 스코틀랜드에서 시중에 유통되지 않은 것으로 파악됨. FSS는 진행 중인 조사와 관련해 영국 식품기준청(FSA)과 긴밀하게 협력하고 있으며, 필요 시 추가 정보를 제공할 것임. *회수 제품 목록: http://www.foodstandards.gov.scot/downloads/List_of_products_withdrawn_FSS_070917.pdf"
264,미국 환경보호청이 클로르피리포스 사용 금지를 철회한 이유는 무엇인가?,해당 문서에 없음,"미국 환경보호청, 클로르피리포스 사용 금지 청원 거절 미 환경보호청(EPA)의 스캇 프루이트 청장은 오늘, 미국 농업에 필수적인 농약 '클로르피리포스(chlorpyrifos)'의 금지 청원을 거절하는 명령에 서명했음. 청장은 ""청은 공중보건과 환경 보호를 유지하면서, 수천 명의 미국 농민들에 규제 확신을 심어줄 필요가 있다. 전세계에서 가장 널리 사용되는 농약 중 하나를 금지하려했던 전(前) 행정부의 행보에 반하는 결정을 내림으로써, 우리는 의사 결정을 내림에 있어 앞서 결정된 결과가 아닌 합리적인 과학 활용의 길로 되돌아가고 있다"" 전함. 2015년 10월, 전 행정부 하의 환경보호청은 제초제의 활성성분인 클로르피리포스의 식품 중 잔류허용기준을 전면 철회를 제안했음. 동 안은 '천연자원협의회'와 '북미 농약조치 네트워크'의 청원에 따른 것으로, 결론 도출에 있어 대부분이 특정 역학연구결과에 의존하였음. 당국은 전 행정부가 활용한 방법론에 동의하지 않음. 마찬가지로, 전국 농업부 연합 또한 같은 뜻임. 연방 제초제진균제살서제법 과학자문단 또한 특정 데이터에만 의존했던 점에 대해 우려를 나타내고 있음."
265,네덜란드 세관이 압류한 DNP 함유 제품은 어디에서 들어왔나요?,홍콩에서 소포우편을 통해 들어왔다고 밝혔음.,"네덜란드 당국, DNP 함유 식이보충제 압류 네덜란드 식품소비자제품안전청(NVWA)은 회색시장에서 DNP 함유 식이보충제를 구할 수 있는 가능성이 증가함에 따라 해당 성분에 대해 경고했음. 2017년 초 DNP가 압류된데 이어, 지난주에도 네덜란드 세관이 7명의 각기 다른 고객을 대상으로 한 제품 7상자(package)를 압류했음. 해당 상자에는 4kg의 DNP 분말과 DNP가 함유된 수백여개 캡슐이 들어있었으며, 기타 정제 및 동화스테로이드도 포함됨. 동 제품들은 세관의 눈을 피하기 위해 초콜릿분말 등과 같은 무해한 식품 원료로 표시됐음. NVWA 대변인은 해당 제품들이 홍콩에서 소포우편을 통해 들어왔다고 밝혔음."
266,캐나다 보건부가 토론토에서 압류한 미승인 성기능 강화 제품 중 'Rush Hour 72'에는 어떤 성분이 포함되어 있나요?,"실데나필, 타다라필, 데스메틸 카르보데나필, 디치오데스메틸 카르보데나필","캐나다, 의약품 성분인 실데나필이 함유된 성기능 강화제 2종 추가 경고 *1월 24일자 기회수 정보에서 제품 추가 캐나다 보건부는 '24시 성인마트(24 Hour Adult Mart)(소재지 토론토)'에서 판매 중인 미승인 건강 제품 중 의약품 성분 타다라필이 검출된 제품 2종을 추가 압류함. 해당 제품은 성기능 강화제를 표방했음. (*제품 사진은 원문의 하단을 참조)  1) Rush, 아질산알킬2) Ram, 아질산알킬3) The Original Jungle Juice Platinum, 질산 이소부틸4) 7K, 요힘빈 5) Extenze Male Supplement, DHEA, 프레그네놀론 및 요힘빈6) Gun Oil High Caliber Performance, DHEA 및 요힘빈7) Herbal Viva, 요힘빈 8) Herbal Vivid, 요힘빈 9) LipsTenZen, 요힘빈 10) Max Desire, 요힘빈 11) Max Stamina, 요힘빈 12) Passion Classic, 요힘빈 13) Red Lips Premium 1 capsule, 요힘빈 14) Rock On, DHEA 15) Rodeo Fantasy, 요힘빈 16) Wet XXX, 요힘빈 17) Magic Mike Enhancement Tablet, 타다라필 (2017.4.26 추가) 18) Morning Wood Liquid Gels, 타다라필 (2017.4.26 추가)"
267,프린스에드워드섬 연어 협회는 아쿠아바운티의 신설 공장에 대해 어떤 조치를 요구하고 있나요?,프린스에드워드섬 연어 협회는 아쿠아바운티의 신설 공장에 대해 연방 정부에 위해 평가를 전면 실시해야 한다고 주장했습니다.,"캐나다 프린스에드워드섬 연어 협회, 아쿠아바운티(사) 신설 공장에 정부 위해평가 요구 캐나다 프린스에드워드섬 동부 지역에 유전자변형(GM) 연어 생산 시설이 신축되는 방안과 관련하여 지역 연어 협회측이 연방 정부에 위해 평가를 전면 실시해야 한다고 주장했음. 그러나 연방 정부의 위해 평가가 새로 필요할지 여부는 아직 불분명함.  아쿠아바운티(사)는 지난 2013년, 포츈 만(滿)의 자사 시설에서 상업용 GM 연어알을 생산해도 좋다는 승인을 받았으며, 이후 미국과 캐나다에서의 식용 GM 연어 판매도 승인 받았음.  업체는 이제 GM 연어를 판매 크기만큼 기를 수 있는 시설을 지역 사회 부근인 롤로 베이 웨스트에 신설하려는 계획을 세우고 있음. 해당 연어는 일반 연어보다 성장 속도가 훨씬 빠름. 이에, 프린스에드워드섬 연어 협회 회장은 새 계획과 관련해 추가 정밀 조사가 요구된다고 주장했음.  한편, 업체는 지난 6월, 공장 설립에 대한 환경영향평가서를 지역 정부에 제출하면서 GMO 활동은 없을 것이라고 밝혔음. 본지(CBC)가 지역 환경부에 위해평가 필요성에 관해 문의했지만 아직까지 답변은 없었음. 현재 해당 정부는 5월 5일까지 공장 신설에 관한 일반 의견을 수렴 중임."
268,캐나다에서 2017년에 파종될 예정인 GM 감자 품종은 무엇인가?,"러셋 벌뱅크, 랭져 러셋, 애틀란틱, 스노우덴","캐나다 농가, GM 감자 첫 파종 계획  지난해 2016년 캐나다에서 'J.R. Simplot Company(사)'의 유전자변형 1세대 감자인 '이네이트(Innate)' 계통이 시기가 맞지 않아 상업용으로 파종되지 않았으나 2017년도에는 다를 것이라는 업계 전문가의 전망이 나왔음. 해당 업체가 보유한 감자 품종은 네 가지로 러셋 벌뱅크, 랭져 러셋, 애틀란틱, 스노우덴이 있음.미국 Simplot 업체 대변인은 캐나다 보건부와 캐나다 식품검사청(CFIA)이 작년 봄에 승인을 내리면서 업체들이 종자 계약과 파종할 시간적 여유가 없었다고 설명했음.해당 감자는 멍이 덜 들어 생산량을 높이고, 아스파라긴 함량을 낮춰 아크릴아마이드가 적게 생성될 수 있도록 개발되었음."
269,유럽집행위원회는 GM대두 DAS-44406-6 시판 신청에 대한 의견수렴을 언제까지 진행하나요?,2017년 4월 24일까지 진행할 예정임.,"유럽집행위원회, '식품 및 사료용 GM대두 DAS-44406-6 시판 신청' 관련 의견수렴 실시 유럽집행위원회는 GM 식품 및 사료에 관한 유럽규정 (EC) No 1829/2003에 따라 2017년 4월 24일까지 '식품 및 사료용 GM대두 DAS-44406-6 시판 신청' 대한 의견수렴을 실시할 예정임. 한편 유럽식품안전청(EFSA)은 2017년 3월 21일, '식품 및 사료용 GM대두 DAS-44406-6'에 대한 견해를 발표한 바 있음.  *의견수렴 페이지: http://ec.europa.eu/food/plant/gmo/public_consultations_en"
270,캐나다에서 유전자변형 연어가 판매된 양은 얼마인가?,5톤,"캐나다, 유전자변형 연어 5톤 가량 판매 유전자변형 연어를 판매 승인한 미국은 표시 문제로 시장 출시가 지연되고 있는 가운데 아쿠아바운티(AquaBounty Technologies)(사)가 금요일(현지시간)에 발표한 보도자료에 따르면, 지금까지 캐나다에서 판매된 유전자변형 연어가 5톤이라고 함. 유전자변형 연어 '아쿠어드밴티지(AquAdvantage)'는 치누크 연어의 성장호르몬 유전자를 함유한 대서양 연어임. 연어는 빠른 성장에 적합한 조건이 되어야 이 호르몬을 만들어 내지만, 아쿠어드밴티지 연어는 언제든지 성장 호르몬 생산이 가능해 성장 속도가 빠름. 유전자변형 연어의 성장 속도는 판매 중량에 이르기까지 2배 빨리 성장해, 총 생산 소요기간이 3년에서 1.5년으로 단축됨은 물론 소비 사료도 10% 줄어듦. 미국 식품의약품청(FDA)은 2015년 11월, 유전자변형 연어를 승인했고, 캐나다 보건부와 식품검사청(CFIA)은 2016년 5월에 이를 승인했음. 업체 관계자는 2017년에 캐나다 판매가 시작됐다고 전했음."
271,캐나다 환경부 장관이 유전자변형 연어 프로젝트에 대해 요구한 것은 무엇인가?,캐서린 멕케나 캐나다 환경부 장관은 프린스에드워드섬에서 유전자변형 연어를 생산하려는 계획에 대해 엄격한 평가 요건을 적용해야 한다고 밝혔다.,"캐나다 환경부장관, 유전자변형 연어 프로젝트에 엄격한 평가 요건 적용해야 캐서린 멕케나 캐나다 환경부 장관은 프린스에드워드섬에서 전세계 최초의 식용 유전자변형 연어를 생산할 계획에 대한 평가가 이루어져야 한다고 밝혔음. 장관은 환경단체에 보낸 서신에서 프린스에드워드섬 롤로 베이에서 아쿠아바운티(사)의 유전자변형 연어인 '아쿠어드밴티지' 연어를 키우려는 업체의 계획은 엄격한 요건에 적용될 것이라고 밝혔음. 아쿠아바운티(사)가 해당 장소에서 유전자변형 연어를 제조하거나 키우려면, '캐나다 환경보호법(1999)'에 따른 신규 통보서가 요구된다고도 밝혔음. 환경단체 '생태액션센터'의 마크 버틀러씨는 캐나다에서 판매용 유전자변형 연어의 생산이 이루어지기 전에 과학적인 환경 위해평가가 진행되기를 바란다고 전했음. 버틀러씨는 자신이 속한 단체와 다른 단체들이 유전자변형 연어의 탈출과 자연산 대서양 연어와의 교배에 관련한 리스크를 걱정하고 있다고 전했음. 지난 6월 프린스에드워드섬 정부는 육상 시설 착공에 관한 아쿠아바운티(사)의 요청을 승인했고, 이는 반대 측이 연방정부의 명확한 입장 요구하도록 유발했음."
272,캐나다 환경단체들이 GM 연어 부화장 증축에 대해 우려하는 이유는 무엇인가?,"GM 연어가 탈출하여 야생 연어와 교배하면 야생 연어의 유전자 구성이 바뀌고, 야생 연어와 경쟁할 수 있기 때문이다.","캐나다 환경단체, GM 연어 부화장 증축 허가에 우려감 캐나다 환경단체들이 연방 정부가 유전자변형(GM) 연어를 시판 크기까지 양식하는 시설에 대해 위해 평가를 실시해야 한다는 주장을 거듭 표했음. 아쿠아바운티(사)의 새로운 부화장이 지난주 지역 정부의 허가를 얻었음.  27일(현지시간), 프린스에드워드섬 대학교에서 소규모로 열린 기자 회견장에서, 지역 및 캐나다 환경 단체 대표 다섯 명은 증축 허가에 우려를 표했음. 특히, GM 연어가 탈출하여 야생 연어와 교배하면 야생 연어의 유전자 구성이 바뀌고, 야생 연어와 경쟁할 수 있다고 생태행동센터 관계자가 전했음.  한편, 지난 CBC 보도에서처럼, 캐나다 환경기후변화부는 새 시설의 사업행위에 대해 연방 정부의 환경 평가가 필요치 않다는 입장을 보였으며, 지방 정부의 위해 평가를 이미 심의한 바 있음. 연방 정부 고시에 따르면, 아쿠아바운티(사)는 무성 생식 연어를 완전 밀폐된 육상 탱크에서 양식해야 하고, 시설 밖으로 이동할 때는 반드시 폐사되어야 한다는 조건이 있음.  아울러, 지역 정부는 연어가 탈출 또는 방출되면 사실을 지역 정부에 알리고, 이러한 경우에 대비한 절차를 마련토록 요청했음.   (참고정보) '캐나다, 아쿠아바운티(사) 공장 증축 허가' (수집일자 2017-06-24)"
273,사우스오스트레일리아에서 GM 작물 재배 금지가 언제까지 연장될 예정인가요?,2025년까지 연장될 것으로 예상됨.,"호주 사우스오스트레일리아, GM 작물 재배 금지 2025년까지 연장 계획  호주 녹색당이 한 표차로 법안을 통과시키면서 호주 사우스오스트레일리아가 논란이 컸던 유전자변형(GM) 작물의 재배 금지를 2025년까지 연장할 것으로 예상됨. 오는 2019년 9월 1일자로 재배 금지가 만료될 예정인 가운데, 해당 법안이 하원도 통과할 것으로 점쳐지고 있음.  사우스오스트레일리아는 본토에서 유일하게 GM 작물 재배를 금하고 있으며, 태즈메이니아 섬은 무기한 재배 금지임. 사우스 오스트레일리아 농업부 장관 대행은 주 정부가 2028년까지 금지를 연장하려 했으나 실패했다고 설명했음.  한편, 야당인 자유당은 재배 금지에 반대하지는 않으나 내년도 선거에서 당선되면 해당 방안을 검토하겠다고 밝혔으며, 로비 단체인 사우스오스트레일리아 곡물 생산자 협회는 재배 금지가 업계 성장을 제한한다고 주장했음."
274,유전자 편집 양구슬냉이를 개발한 기술은 무엇인가?,'CRISPR'라는 기술로 특정 유전자를 제거해 유지가 많이 생성되게 만들었다고 전했음.,"이란, 유전자 재조합 면화 첫선 보여  이란이 순수 자국의 기술력으로 유전자재조합 면화 검체를 처음으로 선보임.  이 유전자재조합 면화는 이란 생명공학 연구소에서 5년간 개발했으며, 이란 환경에 맞추었다고 제1차 국제 및 제9차 국가 생명공학 학술대회에서 공개되었음.  당국은 이 면화가 남부 코라산 지방에서 생산하는 면화 품질의 문제를 해결해줄 수 있을 것으로 보고 있음. 이란은 국회의 생명안전 위원회의 허가를 받아야 농가에서 신기술을 취급할 수 있음. 위원회는 보건부, 농업부, 환경부 대표로 구성되어 있음."
275,Okanagan Specialty Fruits 사가 개발한 아틱 애플은 어떻게 갈변을 억제하나요?,유전자 절단(gene silencing) 기술을 사용하여 과육이 갈색으로 변하게 만드는 효소인 폴리페놀 산화효소가 적게 생산되도록 만들어졌습니다.,"미국, 갈변 일어나지 않는 사과 판매 예정 사과의 갈변현상을 억제시킨 유전자변형 사과(아틱 애플(Arctic Apples)) 개발업체 'Okanagan Specialty Fruits(사)'가 캘리포니아 남부 및 중서부 소재 상점 400여 곳에서 판매될 것이라고 전했음. 업체는 사과를 슬라이스 형태로 봉지에 담아 판매할 계획이지만 ""유전공학 기술로 생산되었다(produced with genetic engineering)""는 표시는 하지 않을 예정이라고 전했음. 대신, 유전자변형 식품의 공개기준법(2016)에서 허용하고 있는 QR코드를 사용해 사과가 어떻게 만들어졌는지에 대한 상세 정보를 웹사이트에서 확인 가능하게 할 것이라고 전했음. 유전자 절단(gene silencing)이라는 기술이 사용된 이 사과는 과육이 갈색으로 변하게 만드는 효소인 폴리페놀 산화효소가 적게 생산되도록 만들어졌음. 업체에 따르면, 유전자변형 사과 슬라이스는 3주 정도 갈변이 없는 상태를 유지할 수 있음. 유전적으로 갈변이 느려지게 만드는 것은 한편으로 문제 해결을 위한 대책으로 여겨질 수 있음. 상업적으로 판매되는 사과 슬라이스는 아마존을 통해 주문한 사과의 갈변이 진행되지 않도록 이미 비타민 C와 칼슘 혼합물로 보존 처리되고 있음. 가정에서는 몇 시간 동안 레몬즙에 담그는 방법이 사용되고 있음. 유전자변형생물체 반대 단체는 업체의 유전자변형 사과 도입을 반대하고 있으며, 버거킹과 같은 식품기업에 이를 판매하지 말라 요구하고 있음. 하지만 개발업체는 갈변이 일어나지 않는 사과는 그 판매량을 높이고 쓰레기 생성을 줄여줄 수 있다고 전했음. UN에 따르면, 과일과 채소의 약 45%가 버려지고 있는데 이는 소매업체의 재배(picking) 또는 운송 과정이나 까다로운 소비자의 손에서 버려지고 있다고 함."
276,우간다에서 GMO 바나나 시범 재배의 주된 목적은 무엇인가?,각기 다른 농업 생태계 구역에서 세균성 시들음병에 내성을 보이는지 확인하는 것과 프로 비타민 A가 함유될 수 있게 만드는 것이다.,"우간다, GMO 바나나 시범 재배 승인...2021년 출하 목표 우간다 국립농업연구소(NARL)이 유전자 변형(GM) 바나나에 대해 오는 20201년 출하를 목적으로 공개 시범 재배 준비를 갖추었다고 발표했음. 공개 시범 재배는 농가와 지역사회에서 GM 바나나 품종을 시범 재배하여 각기 다른 농업 생태계 구역에서 세균성 시들음병에 내성을 보이는지 확인하는 것을 의미함.  초록색 피망(green pepper)에서 얻은 세균성 바나나 시들음병 내성 유전자와 우간다에서 자라지 않고, 동남 아시아에서만 발견할 수 있는 바나나 품종에서 프로 비타민 A 유전자를 기존 바나나 품종에 주입하여 세균성 바나나 시들음병 내성과 프로 비타민 A가 함유될 수 있게 만들었음.  세균성 바나나 시들음병은 우간도에서 2001년 처음 보고된 이후 전 지역으로 확산되었으며, 중앙과 서부 지역의 피해가 컸음."
277,국제원자력기구 전문가들이 후쿠시마 원전 인근을 방문하는 주된 목적은 무엇인가?,"후쿠시마현의 해수, 해양 퇴적물, 어류 샘플 수집을 통해 방사능 데이터 수집 및 분석의 품질 보증을 지원하기 위함이다.","국제원자력기구, 후쿠시마 제1원자력발전소 인근 해수, 해양 퇴적물 및 어류 샘플 수집 예정 국제원자력기구(IAEA) 전문가들은 다음 주에 일본을 방문하여 후쿠시마 현 연안 해역의 해수, 해양 퇴적물 및 어류 제품의 샘플을 수집할 예정임. 목표는 2014년에 시작된 프로젝트에 참여한 일본 연구소의 방사능 데이터 수집 및 분석에 대한 품질 보증을 지원하는 것임. 11월 9-12일의 파견은 방사능 분석에 대한 실험실 간 비교를 위해 도쿄전력(TEPCO)의 후쿠시마 제1원자력발전소(NPS) 인근 해양 표본 샘플 수집 차 방문한 2014년 이후, IAEA의 11번째 방문임. 동 방문은 TEPCO의 후쿠시마 제1원전 1-4호기 해체를 위한 중장기 로드맵에 대한 IAEA 국제 동료검토임무의 2013년 보고서에서 해양 모니터링에 대한 권장사항의 지속적인 후속활동임. 평가단은 모나코의 IAEA 환경 연구소 직원 2명과 환경방사능 측정을 위한 분석 연구소 네트워크의 전문가 3명으로 구성됨. 평가단은 후쿠시마 제1원전 인근 해수와 해양 퇴적물을 수집할 뿐만 아니라, 후쿠시마 현 수산시장의 어류 샘플을 관찰할 예정임."
