id,질문,정답,top1 문서
500,미시간주에서 CBD를 식품이나 음료에 첨가하는 것이 불법인 이유는 무엇인가?,FDA가 그러한 제품의 사용을 승인하지 않았기 때문임.,"미국 미시간주, 미시간에서 식품/음료에 CBD 첨가는 불법이라고 권고 지난주 금요일에 미시간주(state agencies)에서는 마리화나와 대마(hemp) 관련 제품에 대한 지침(guidance)을 발표함. 마리화나 규제국(Bureau of Marijuana Regulation)과 미시간 농무부 (Agricultural and Rural Development)의 공동 성명서는 대마(hemp) 파생물 CBD 오일을 포함하여 마리화나 및 대마 제품에 대해 합법과 불법인 것에 대한 몇가지 핵심 사항(key point)을 명확히 함. 지침에 따르면 CBD를 식품 또는 음료에 사용하거나, 보충제로 판매하는 것은 현재 불법임. 그 이유는 FDA가 그러한 제품의 사용을 승인하지 않았기 때문임.  Newschannel3과 인터뷰한 한 사람은 잠시 동안 합법적이지 않을 것이라는 것이 좋은 생각이라고 생각한다며, 좋은제품인지 모르겠고, 사람들이 제품을 충분히 알지 못한다고 언급함. 인터뷰한 사람과 같은 쇼핑객은 Kalamazoo 지역 상점에서 CBD 제품으로 판매되는 Colorado Hemp Honey를 찾을 수 있음.  지침 소식에 대해 들은 후에 한 가게 매니저는 선반에서 Colorado Hemp Honey를 제거할 지 기업과 상의해야한다고 언급함. 어떤 것이 CBD 제품으로 간주되는지에 대해서는 애매한 부분(gray area)도 있음. 예를 들어, Colorado Hemp Honey에는 CBD가 단지 하나의 구성 요소일뿐인 전체 범위(스펙트럼)의 대마 추출물이 함유되어 있음."
501,Tim Campbell Farm flat parsley 제품의 회수 이유는 무엇인가요?,제품에서 리스테리아 모노사이토제네스가 검출됨.,"[E/R]미국 Tim Campbell Farm LLC, 리스테리아 검출로 파슬리 제품 회수 -지역: 미국 MI-제품명: Tim Campbell Farm flat parsley in wooden crate. 순중량(net weight) 또는 수량(quantity)은 표시되어있지 않음. (Lot Code:07MF2022520225, Pack Date 20225)-회수사: Tim Campbell Farm LLC (회수중, 회수일: 9/2/2020)-회수사유: 제품에서 리스테리아 모노사이토제네스가 검출됨."
502,노스아일랜드 서해안에서 어떤 종류의 패류를 섭취하지 말아야 하나요?,"홍합, 굴, 투아투아, 피피, 토헤로아, 새조개, 가리비, 캐츠아이, 키나 및 모든 쌍각류 패류는 먹지 말아야 합니다.","뉴질랜드 일차산업부, 레글런 등 노스아일랜드 서해안 지역 패류 생물독소 경고 일차산업부는 오늘 노스아일랜드 서해안의 사우스 헤드(South Head)부터 타우라타히(Tauratahi) 지점까지 해당 지역에서 패류를 채취 또는 섭취하지 말 것에 대한 공중보건 경고를 발행하였음. 해당 지역에서 채위한 패류 샘플에 대한 정기 검사에서 마비성 패독(Paralytic Shellfish Poisoning (PSP) toxins)이 MPI가 설정한 안전기준치인 0.8 mg/kg을 넘는 양이 검출되었음. 해당 지역의 패류를 섭취한 경우 발병 위험이 있을 수 있음. *경고 지역: https://www.mpi.govt.nz/travel-and-recreation/fishing/shellfish-biotoxin-alerts/#map-westcoast 홍합, 굴, 투아투아(tuatua), 피피(pipi), 토헤로아(toheroa), 새조개(cockles), 가리비(scallops), 캐츠아이(catseyes), 키나(성게) 및 모든 쌍각류 패류는 먹지 말아야 함. 파우아, 게, 가제는 내장에 독소가 축적되기 때문에 조리 전에 내장을 완전히 제거한 경우에는 계속 섭취할 수 있음. 내장을 제거하지 않은 경우, 조리 과정 중에 고기가 오염될 수 있음. 슈퍼마켓 등의 매장에서 판매되거나 수출되곤 하는 상업적으로 채취하는 패류의 경우 MPI의 엄격한 수질 모니터링 프로그램에 의해 관리되어 섭취에 안전함."
503,Red Monkey Foods Inc가 회수하는 건조 파슬리 제품의 유통기한은 언제인가요?,"World Market: BEST BY: 24 MAR 2023, Organics: BEST If Used By: MAR 25 23, Clearly Organic: Best If Used By MAR 25 2023, Great Value: BEST If Used By: MAR 11 2023, Full Circle: Best By: 11 MAR 2023","[회수]미국 Pinnacle Foods Inc., 리스테리아 오염 가능성으로 냉동완두콩 회수 - 일시: 2016.6.21- 지역: 미국 전역 및 온라인 - 제품명: *냉동제품1) CW Early Harvest Petite Peas (16 oz., UPC 0-70332-00159-4, 유통기한 Mar-07-18, Mar-17-18, Mar-28-18, Mar-29-18)2) CW Petite Peas (16 oz., UPC 0-70332-00158-7, 유통기한 Mar-23-18, Mar-28-18, Mar-29-18)- 회수사: Pinnacle Foods Inc.- 회수사유: 리스테리아 모노사이토제네스 오염 가능성 - 기타: 관련 질병 보고 없음. 업체는 포장 하청업체 'National Frozen Foods(사)'가 상기 사실을 알려오면서 제품을 회수하게 되었음."
504,덴마크에서 발생한 캠필로박터 감염의 원인으로 의심되는 제품은 무엇인가?,보른홀름 유업의 저온 살균 우유,"덴마크 국립식품연구소, 캠필로박터 감염의 주요 원인은 닭고기 덴마크 국립식품연구소는 덴마크 내 캠필로박터 감염의 거의 절반 가량(46%)이 국내산 닭고기 섭취로 인한 것이라는 보고서(*)를 발표했음. 다른 원인으로는 소(쇠고기, 우유 또는 직접접촉) 19%, 수입 닭고기 섭취 9%가 뒤를 이었음. 동 결과는 덴마크 수의식품청(DVFA), 국립혈청연구소(SSI), 코펜하겐 대학교가 2년 이상 수집한 데이터 자료를 바탕으로 했으며, 샘플 분석은 MLST 방법을 사용함. 동 데이터는 정부 및 업계가 향후 캠필로박터 관련 행동 계획 마련 시 사용 할 것임.   *보고서전문: http://www.dtu.dk/english/-/media/Institutter/Foedevareinstituttet/Publikationer/Pub-2017/Report-Source-Attribution-Campylobacter-FINAL.ashx?la=da"
505,뉴질랜드에서 코로나 경보 4단계 동안 맥도날드 배달이 가능한가요?,"모든 식당, 카페 및 바는 배달을 포함하여 운영을 할 수 없다고 강조함.","뉴질랜드, 코로나바이러스와 관련하여 맥도날드는 폐쇄하고 배달 서비스 등은 유지해 (*) 식품 관련 정보만 수집 뉴질랜드 총리 저신다 아던(Jacinda Ardern)은 금일 오후 경계 단계를 3 단계로 올리고, 수요일 오후 11시 59분부터 전국적인 봉쇄를 시작하도록 함. 식당은 수요일 저녁 경계 4단계 시작할 때까지 오직 포장만 가능하며, 그후에는 폐쇄됨. 맥도날드는 수요일 늦은 저녁 ""기한 시간 전""에 폐쇄할 것임. 그때까지 테이크어웨이, 드라이브스루, 맥 딜리버리 등을 통해 빅맥을 구매할 수 있음. 식당에서 식사하는 것은 경계 3, 4 단계 이전의 일임. 4주간의 봉쇄 기간 동안 패스트푸드나 포장 음식 옵션은 없을 것임."
506,독일에서 H5N8 고병원성 조류 인플루엔자가 처음 발생한 날짜는 언제인가요?,2020년 3월 27일입니다.,"세계동물보건기구, 고병원성 조류 인플루엔자 동물 감염 현황(10.30-독일) 1. 독일, H5N8 (즉각보고서)   - 최초발생일: 2020.10.26  - 발생보고일: 2020.10.30  - 발생지역: Hamburg에서 1건 발생  - 발생규모: 의심-건, 감염1건, 폐사0건, 폐기1건, 도축0건  - 기타: 진행형이며, 추후 보고가 제출될 예정임."
507,브라질산 닭날개에서 COVID-19 양성반응이 나왔다는 경고에 대해 WHO는 어떤 입장을 밝혔나요?,"WHO는 지금까지 식품에서 COVID-19가 감염된 사례는 없다고 전하며, 식량 체인에는 문제가 없다고 밝혔습니다.","세계보건기구, 식품체인을 통하여 코로나바이러스에 감염된다는 증거 없어 세계보건기구(WHO)는 브라질산 닭날개가 COVID-19 검사에서 양성반응을 보였다는 중국 당국의 경고가 나온 후, 지금까지 식품에서 COVID-19가 감염된 사례는 없다고 전함. WHO의 대표 전염병학자 밴커코브(Maria Van Kerkhove) 박사는 이번 목요일 (8.13) 검사된 10만 개 이상의 패키지 중 단 10개 미만의 감염건이 발견되었으며, 이러한 식품을 취급하는 이들을 대상으로 하는 지침을 유엔식량농업기구와 함께 발표한 바가 있음을 상기시켰음. 마이클 라이언(Michael Ryan) 박사는 사람들은 이미 COVID-19에 대해 충분히 두려워하고 있기 때문에, 더 이상의 두려움 없이 일상생활을 할 수 있도록 이러한 발견들을 면밀히 관찰하는 것이 중요하다며 ""식량 체인에는 문제가 없다""고 덧붙임. 실태 조사는 계속하겠지만 이번 바이러스의 전파에 먹이사슬이 관여하고 있다는 증거는 없다고 함."
508,Lancaster Foods LLC가 회수한 적양파는 어떤 지역에 유통되었나요?,"미국 PA, AR, MD, MA, VA, DE, CT 지역 내 다양한 소매업체에 유통되었습니다.","[E/R]미국 Lancaster Foods LLC, 살모넬라 오염 가능성으로 적양파 회수 -지역: 미국 PA,AR,MD,MA,VA,DE,CT 지역 내 다양한 소매업체에 유통되었음.-제품명: Red Onions, Bulk(모든 SKUs)-회수사: Lancaster Foods LLC (회수중, 회수일: 8/10/2020)-회수사유: 살모넬라 오염 가능성"
509,캐나다에서 장염비브리오균 감염이 발생한 주는 어디인가요?,"서스캐처원, 퀘벡, 뉴브런즈윅, 프린스에드워드아일랜드","캐나다, 뉴브런즈윅 주 위장질환을 유발하는 패류 세균 감염 발생 뉴브런즈윅 주 보건당국은 인간에게 위장 질환을 유발하는 패류 세균, 장염 비브리오(vibrio parahaemolyticus) 감염 발생을 발표함. 보건 당국은 감염 사례가 9건이 확인되었으며, 평균적으로 뉴브런즈웍 주는 감염 사례가 1년에 2-3건에 불과했다고 언급함. 뉴스 보도에서 Dr. Jennifer Russell 은 패류를 섭취할 시 날것으로 또는 덜 익혀서 먹으면 질병을 유발할 수 있으니 충분히 조리해서 먹고 보관 시 냉장고나 냉동실에 보관할 것을 당부했음."
510,캐나다 정부는 중국 우한 지역 방문 시 어떤 음식을 피하라고 권고했나요?,날 것이나 덜 익은 음식 및 육류를 멀리하여 안전하게 먹고 마실 것을 권고했습니다.,"캐나다 정부, 코로나바이러스 관련 중국 우한 지역 방문 시 권고사항 발표 캐나다 정부는 코로나바이러스와 관련하여 중국 우한 인근지역 방문 시, 다음과 같은 권고사항을 게재했음. (*식품 안전 관련 내용만 발췌) - 날 것이나 덜 익은 음식 및 육류를 멀리하여 안전하게 먹고 마실 것- 농장, 살아있는 동물 시장, 동물을 도살할 수 있는 지역 등 고위험 지역을 피할 것- 돼지, 닭, 오리, 야생 조류, 그들의 체액에 오염된 물품 등 동물(생체 또는 사체)과의 접촉을 피할 것"
511,동유럽에서 아프리카돼지열병이 가장 많이 발생한 국가는 어디인가요?,"헝가리, 폴란드, 루마니아가 유럽에서 가장 많은 ASF건수를 보고하고 있습니다.","영국 환경식품농촌부, 동유럽의 아프리카돼지열병 현황 보고서 업데이트 영국 환경식품농촌부(Defra)는 6월 24일 기준 동유럽 아프리카돼지열병(ASF) 발생에 관한 평가 보고서(Ref: VITT/1200 ASF in Europe (Eastern Europe))(*)를 게재함.  헝가리, 폴란드, 루마니아가 유럽에서 가장 많은 ASF건수를 보고하고 있다고 함.2019년 8월 이후 벨기에, 불가리아 등 총 15개 유럽국가에서의 발생 현황이 나타난 표를 담고 있음. (*) https://assets.publishing.service.gov.uk/government/uploads/system/uploads/attachment_data/file/896197/asf-east-europe-update11.pdf"
512,Super Vege 브랜드 Fresh Cookies의 회수 이유는 무엇인가요?,이미 이취,"[회수]캐나다 Super Vege Pizza Inc., 이미 이취로 비스킷 및 쿠키 회수 - 일자: 2020.06.22(발표일자: 2020.06.30)- 유통지역: 캐나다 British Columbia, Ontario 소매점- 제품명:1) Mampster 브랜드 Old Fashion Punjabi Biscuits (중량: 681 g, 코드: 없음, UPC: 6 28950 00190 0)2) Super Vege 브랜드 Fresh Cookies (중량: 1.5 lbs, 코드: 없음, UPC: 없음)- 회수사: Super Vege Pizza Inc.- 회수사유: 이미 이취- 제품사진: -"
513,Aminature L-Cysteine HCl Anhydrous 100 mesh 25KG DRUM의 회수 이유는 무엇인가?,"이물질, 금속 발견","[E/R]미국 Cj Haide (Ningbo) Biotech Co., Ltd, 금속, 이물질 발견으로 무수 L-시스테인 염산염 회수 -지역: 미국 NJ, CT, CA, FL-제품명: Aminature L-Cysteine HCl Anhydrous 100 mesh 25KG DRUM(Lot Numbers: IABF181011; IABF190802; IABF190926)-회수사: Cj Haide (Ningbo) Biotech Co., Ltd (회수중, 회수일: 2/21/2020)-회수사유: 이물질, 금속 발견"
514,The Coca-Cola Company가 회수 중인 음료 제품은 무엇인가요?,Minute Maid STRAWBERRY LEMONADE FLAVORED WITH OTHER NATURAL FLAVORS와 Minute Maid WATERMELON FLAVORED FRUIT DRINK WITH OTHER NATURAL FLAVORS입니다.,"[E/R]미국 The Coca-Cola Company, 고과당옥수수시럽 미표시한 닥터페퍼 체리맛 음료 회수 -지역: 미국 캘리포니아-제품명: Dr. Pepper Cherry, 12oz (12 pack cans) (업체 'Doctor Pepper Company(사)'의 허가를 받아 제조됨)-회수사: The Coca-Cola Company (회수종료, 회수일 3/31/2016)-회수사유: 고과당옥수수시럽 미표시"
515,Uncle Ben’s brand Brown Basmati 즉석밥의 회수 이유는 무엇인가요?,이물질(유리) 함유 가능성 때문입니다.,"[회수]아일랜드 식품안전청, 유리조각 함유 가능성으로 영국산 데워먹는 즉석밥제품 회수 - 일자: 2020.7.27- 공고번호:2020.41- 제품: Uncle Ben’s Brown Basmati (용량: 250g; Best Before: 08/01/2021, 18/01/2021, 16/03/2021, 24/05/2021, 14/06/2021, 03/07/2021, 17/11/2020, 08/12/2020, 09/12/2020)- 원산지: 영국(UK)- 회수사유: 유리 조각 발견- 제품사진: 원문참조"
516,Ingredients Solutions Inc.가 카라기난 제품을 회수한 이유는 무엇인가?,"업체의 고객이 최종 카라기난 제품에서 최대 1/4""의 유색섬유를 발견했기 때문이며, 이 섬유는 카라기난 제조에 사용되는 해초 원료의 생산 시 사용되는 섬유로프 'tie tie'로 확인되었기 때문이다.","[E/R]미국 Ingredients Solutions Inc., 섬유로프 발견으로 카라기난 회수 -지역: 미국 IA, KS, WI, KY-제품명: MBF-202 Carrageenan(191001-A 191001-B 191002-A Use by dates: 10/01/21  10/02/21 191002-B 191003-A)-회수사: Ingredients Solutions Inc. (회수중, 회수일: 8/27/2020)-회수사유: 2020년 8월 28일, 업체의 고객이 최종 카라기난 제품에서 최대 1/4""의 유색섬유(colored fibers)를 발견했음. 회수사는 이 섬유를 카라기난 제조에 사용되는 해초 원료의 생산 시 사용되는 섬유로프, 'tie tie'라고 확인하였음. 2020년 8월 28일 업체는 최종 카라기난을 회수조치함."
517,Woolworths에서 구매한 샐러드 제품에서 발견된 금속 물체로 인해 다친 사람은 누구인가요?,여성의 혀를 베었으나 아기는 다치지 않았습니다.,"호주, 대형마트 샐러드제품에서 금속물질 발견돼 호주 NSW에서 한 가족이 면도날처럼 보이는 두 개의 이상한 금속 물체가 Woolworths에서 구매한 샐러드 제품에서 발견되었다고 주장함. 이들은 시드니 북서쪽 Cherrybrook 매장에서 코울슬로 제품(American Coleslaw Kit)을 구입했고 저녁 식사를 내놓은 뒤 문제가 생겼다고 함.봉지 안에서 발견된 두 개의 금속 칼날 중 한 개가 여성의 혀를 베었으나 아기는 다치지 않았다고 함. 여성은 Woolworths 슈퍼마켓 측에 가능한한 빨리 샐러드 봉지를 검토하고 회수할 것을 요청했으나 슈퍼마켓 측은 이 이론이 사실일 가능성은 낮다고 말했음."
518,Exceldor Coopérative가 회수한 Seasoned Tied Chicken의 유통지역은 어디인가요?,캐나다 퀘벡 소매점,"[회수]캐나다 Exceldor Coopérative, 공정 잔류물 혼입으로 양념 닭고기 회수 - 일자: 2020.04.29. (발표일자: 2020.05.01.)- 유통지역: 캐나다 퀘벡 소매점- 제품명: ​Seasoned Tied Chicken(브랜드: - ; 크기: 27-30 kg; 제품 코드: Packed on 2020AL14, Best Before 2020AL26, UPC: N.A.)- 회수사: Exceldor Coopérative- 회수사유: 공정 잔류물 혼입- 제품사진: -"
519,European Bakery Ltd가 회수한 빵의 종류는 무엇인가요?,"European Bakery Ltd가 회수한 빵의 종류는 Dark Rye Sourdough Rolls, Dark Rye Batard, Dark Rye Loaf, Multigrain Sourdough, Fitness Loaf 등입니다.","[회수]영국 P&B (Foods) Ltd, 알레르기 유발성분 밀 미표시로 빵가루 회수 - 일시: 2016.2.4- 제품명: Heera Premium Quality Golden Bread Crumbs (3kg/ 1kg/ 400g, 전 배치 제품)- 브랜드명: Heera- 회수사: PB (Foods) Ltd- 회수사유: 알레르기 유발성분 밀(글루텐) 미표시- 기타: PB (Foods) Ltd(사)는 해당 제품 판매를 중단하고 라벨을 재부착할 예정임- 제품사진: http://www.food.gov.uk/sites/default/files/heera-golden-bread-crumbs-images.pdf"
520,Grain Processing Corporation이 회수 중인 Pure Dent¿ B700 Food Corn Starch의 회수 사유는 무엇인가?,고객이 옥수수전분 재료 속에서 1-30 mm 길이의 금속 조각을 발견했기 때문이다.,"[E/R]미국 Grain Processing Corporation, 금속 이물질 발견으로 옥수수 전분 제품 회수 -지역: 미국 KY, OH, MN, MO, WI 지역 및 캐나다-제품명: Pure Dent¿ B700 Food Corn Starch, 50 lb 포장(Lot #: 1B000239979)-회수사: Grain Processing Corporation (회수중, 회수일: 2/20/2020)-회수사유: 고객이 옥수수전분 재료 속에서 1-30 mm 길이의 금속 조각을 발견함."
521,Mcclancy Seasoning Company가 회수한 Bojangles Complete Dirty Rice Mix의 회수 사유는 무엇인가?,쌀 공급업체로부터 제품에 파란 플라스틱 조각이 혼입되어 있다고 통지받았기 때문입니다.,"[E/R]미국 Mcclancy Seasoning Company, 플라스틱 이물 혼입으로 쌀 가공품 제품 회수 -지역: 미국 FL, GA, NC-제품명: 케이스 라벨: Rice Dirty Mix Comp 24-17.9 oz bags/case, 다음업체를 위해 포장되었음: BR 9432 SOUTHERN PINE BLVD. CHARLOTTE, NC 28273. 봉투 라벨: Bojangles Complete Dirty Rice Mix Net Wt: 17.9 oz bags(Item No. Lot # RP061948 Best by 11/21/20; Lot #RP061949 Best by 11/24/20  Lot # RP062265 Best by 11/29/20)-회수사: Mcclancy Seasoning Company (회수중, 회수일: 3/13/2020)-회수사유: 이물질 혼입(회수사는 쌀 공급업체로부터 제품에 파란 플라스틱 조각이 혼입되어 있다고 통지받음)"
522,WILD MUSHROOM BARLEY soup 제품의 회수 사유는 무엇인가요?,구더기 함입 가능성,"[회수]영국 BOL Foods, 알레르기 유발성분 우유 및 보리 미표시로 커리 회수 - 일시: 2018.5.1- 제품명: BOL Caribbean Jerk Curry (345g, 소비기한: 5 May 2018)- 회수사: BOL Foods- 회수사유: 알레르기 유발성분 우유 및 보리(글루텐) 미표시- 제품사진: https://s3-eu-west-1.amazonaws.com/fsa-alerts-files/production/FSA-AA-39-2018/customer-notice-bol-jerk-curry.pdf"
523,Regal Epicurean 브랜드 Lemon Pepper Hot Smoked Salmon의 회수 사유는 무엇인가요?,유통기한 오기입,"[회수]뉴질랜드 The New Zealand King Salmon Co. Ltd, 유통기한 오기입으로 훈제 연어 회수 - 일자: 2020.1.17- 유통지역: 뉴질랜드 lower North Island의 Pak’n Save 및 New World 슈퍼마켓- 제품명: Regal Epicurean 브랜드 Lemon Pepper Hot Smoked Salmon(125g)(일자: 20.2.19까지, 플라스틱 포장)- 회수사: The New Zealand King Salmon Co. Ltd- 회수사유: 유통기한 오기입- 제품사진: 원문 참조- 기타: 수출되지 않았음"
524,'천연(natural)' 표시가 있는 식품이 실제로 건강에 좋은가요?,"국제식품정보위원회(IFIC) 조사에 따르면, 소비자의 70%가 '천연' 표시 식품을 더 건강하다고 인식하지만, 이를 뒷받침하는 과학적 근거는 없으며 식품의약품청(FDA)에서도 명확히 정의하지 않았음","미국, 소비자의 70%는 'natural' 식품이 건강할 것이라고 하지만 마케팅 과대광고를 뒷받침하는 과학적 근거 없어 국제식품정보위원회(IFIC)는 매년 소비자를 대상으로 다른 식품 표시가 그들의 구매습관에 영향을 미치는 방법 등의 다양한 주제에 대하여 조사를 실시함. 2019 식품 및 건강 조사(2019 Food  Health Survey에 따르면, 소비자의 1/3 이상이 식품을 구매할 때 유기농이나 비GMO표시보다도 천연 제품 표시에 동요된다고 함. 단어는 행동에 강력한 영향력을 미치는 것임. 소비자는 천연 표시가 있는 제품을 매우 구매하고 싶어 할뿐만 아니라, 넓은 범위의 특징을 그러한 표시가 있는 제품에 속하는 것으로 생각하기도 함. IFIC는 소비자들에게 ""모두 천연(all natural)"" 표시가 있는 제품과 표시가 없는 동일한 제품 중 어떤 것이 더 건강한지 질문했음. 조사한 소비자의 70%는 ""천연(natural)""제품이 다소 또는 매우 건강할 것이라고 인식했음. ""천연"" 단어는 소비자에게 감정적인 매력이 있으나, 대부분은 단어 자체가 식품의약품청(FDA)에 의해 정의 내려지지 않았음을 알게 되면 놀랄 것임. ""천연"" 표시에 대한 엄격한 기준이 없기 때문에, 대부분의 포장식품에 적용될 수 있음. 식품 포장에 이 표시가 있을 때, 사람들이 생각하는 것만큼 그렇게 큰 의미가 있는 것은 아님에도 불구하고 이는 강력한 마케팅 도구임."
525,Siete Grain Free Burrito Size Tortillas 제품의 회수 이유는 무엇인가요?,"나트륨 함량 오표시 때문입니다. 라벨에는 나트륨 함량이 15 mg으로 표시되어 있었으나, 실제로는 제공량 당 340 mg이었습니다.","[E/R]미국 BakeryWorks LLC, 미표시된 알레르기 유발물질 달걀 함유 가능성으로 토르티야 제품 회수 -지역: 미국 Chicago, IL-제품명: UnTortillas Grain Free. 210g 봉투 당 토르티야 6개, 케이스 당 8개 포장. UPC# 40628250179024 (Lot# 20310-07 및 20307-07)-회수사: BakeryWorks LLC (회수중, 회수일: 2/18/2021)-회수사유: 미표시된 알레르기 유발물질 달걀 함유 가능성"
526,캔버라의 스포츠용 보충제 업체 소유주는 어떤 혐의로 유죄 판결을 받았나요?,캔버라의 스포츠용 보충제 업체 소유주는 치료용 제품 규정(ARTG)에 포함되지 않은 치료용품을 광고한 혐의와 처방 의약품을 광고한 혐의로 유죄 판결을 받았습니다.,"호주 연방의료제품청, 캔버라의 한 업체는 스포츠용 보충제 불법 광고로 유죄 판결 받아 호주 연방의료제품청의 조사에 따라, 한 방성은 의료제품법1989하에 스포츠용 보충제 불법 광고로 유죄 판결을 받음.2020년 7월 29일, ACT 경범죄 법정은 캔버라에 소재한 스포츠용 보충제 업체의 이전 소유주에게 4가지 혐의로 유죄를 선고 하였음. 이번 건의 경우, 이전 소유주는 치료용 제품 규정(ARTG)에 포함되지 않은 치료용품(스포츠용 보충제)를 광고한 혐의로 유죄 판결을 받았으며, 해당 제품들은 의료제품법1989에서 면제 또는 제외되지 않았음. 또한 처방 의약품을 광고한 혐의로도 유죄판결을 받음."
527,Marc Ching은 어떤 제품의 허위광고로 법원 명령을 받았나요?,"Marc Ching은 'Thrive'라는 비타민C·허브추출물 함유 식이보충제가 코로나19를 치료, 예방한다거나 그 위험성을 줄이는 데에 효과가 있다고 광고한 것에 대해 법원 명령을 받았습니다.","미국 연방거래위원회, Thrive 보충제 판매자에 코로나19 관련 허위 광고 금지 명령 미국 연방거래위원회(FTC)가 식이보충제 'Thrive' 판매자 Marc Ching에 해당 제품이 코로나19를 치료, 예방하는데 효과가 있거나 그 위험성을 줄인다는 광고를 하지 못하도록 했음. Thrive의 주요 성분은 비타민C와 약초 추출물임.  해당 명령에는 이 외에도 칸나비디올(CBD) 포함 제품과 관련해 암을 치료하거나 예방할 수 있다는 허위 광고를 하지 못하도록 하는 내용도 포함되었음. Marc Ching 케이스는 코로나19 허위 광고 관련으로 연방거래위원회가 판매자를 고발한 첫 사례로, 지난 4월 Marc Ching이 연방 법원의 예비 명령에 승복했다고 발표된 바 있음. 연방거래위원회는 Marc Ching이 2020년 3월부터 Thrive 제품이 코로나19의 치료, 예방에 효과가 있다고 광고했으나 사실상 그 증거는 존재하지 않는다고 밝혔음. 한편 현재까지 코로나19관련 허위 광고를 한 275개 이상의 업체에 경고장이 발부되었음."
