id,질문,정답,top1 문서
1,"캐나다 정부가 건강영향평가를 실시하기로 한 농약 중 2,4-D는 몇 개 제품에 사용되나요?",140개 제품에 사용됨.,"캐나다 보건부, 2,4D 에 관한 국제암연구소의 발표에도 캐나다의 2,4D 지위에는 변동 없어 캐나다 보건부는 이번주 초 세계보건기구(WHO) 산하의 국제암연구소가  2,4D 성분이 ""발암 가능성""이 있는 것으로 분류한다는 발표에도 불구하고 캐나다에서 이 화학물질의 지위는 변동없을 것이라고 전함. 당국 대변인은 캐나다 보건부가 2008년  2,4D에 대한 검토를 통해 농업지와 주택에서 라벨 안내사항에 따라 지속적으로 사용할 경우 인체 우려사항을 발생시키지 않는다고 결론지었다고 수요일(현지 시간), 이메일을 통해 밝혔음. 캐나다 보건부는 국제암연구소가 전 세계에서 가장 널리 사용되는 제초제 중 하나인 2,4D를 ""인체 발암 가능성""이있는 것으로 분류되어야 한다고 전한지 몇 일 지나지 않아 이 같은 답변을 전했음. 한편, 북아메리카 생명공학산업계는 국제암연구소가 발표한 이번 결론이 다른 국제연구소에서 수행한 결과와 일치하지 않는다고 주장하며 강력히 비난했음."
2,유럽식품안전청의 화학적 위해요인 데이터베이스는 어떤 자료를 기반으로 업데이트되었나요?,"유럽식품안전청의 화학적 위해요인 데이터베이스는 EFSA 패널이 채택한 평가의견과 성명에서 자료를 추출하여 업데이트되었으며, 이번 업데이트에서는 2014년 2월분 자료를 반영했습니다.","유럽식품안전청, 화학적 위해요인 데이터베이스 추가 개발 및 업데이트 유럽식품안전청(EFSA)은 식품 및 사료의 자체 화학적 위해평가에서 도출한 위해요인 데이터 요약을 이용해 화학적 위해요인 데이터베이스를 채워나가고 있음.화학적 위해요인 데이터베이스는 EFSA의 평가의견, 성명, 결과나 상세 설명(화학물질, 서류 설명, 위해요인, 위해요인 특성/위해성 특성)에서 뽑은 위해요인 자료들을 맵핑하는 용도로, 특히나 위해요인 데이터를 주요하게 다루고 있음.데이터베이스는 NDA, CONTAM, FEEDAP, AFC, AFC 등 EFSA 패널이 채택한 평가의견과 성명에서 자료를 추출하며, 화학물질 분류에 속하지 않는 성분(예: 미생물 및 효소)는 데이터베이스에서 제외됨.이번 업데이트에서는 2014년 2월분 자료를 반영했음.*연구 전문 http://www.efsa.europa.eu/en/supporting/doc/654e.pdf"
3,Jumbo UK Ltd의 검은콩 회수 이유는 무엇인가요?,건조된 콩이 훈증제로 사용되는 알루미늄포스파이드와 함께 수송되어 예방 조치로 회수함.,"[회수]영국 Jumbo UK Ltd, 알루미늄포스파이드 오염 위험으로 검은콩 회수 영국 식품기준청, 'Jumbo UK Ltd'의 검은콩을 알루미늄포스파이드 오염 위험으로 회수 발표 - 일시: 2014. 10. 16.- 제품명: Brown Beans(1kg, 1.5kg, 4kg, 모든 배치 제품)- 브랜드명: Nigeria Taste- 회수사: Jumbo UK Ltd- 회수사유: 건조된 콩이 훈증제로 사용되는 알루미늄포스파이드(aluminium phosphide)와 함께 수송됨. 알루미늄포스파이드가 검출된 제품은 없으나 예방 조치로 회수함."
4,머크사는 왜 2013년에 질맥스 판매를 중단했나요?,젖소의 보행이 어려운 문제로 인해 동물 복지가 우려되었기 때문입니다.,"미국 머크(사), 당사의 동물용 의약품 안전성 검사 진행 중에 있으나 모호한 부분 많아.. 미국 머크(사)(Merck  Co Inc.)가 미국 소(cattle) 240,000마리의 검사를 통해 사료첨가제로 논란이 많았던 당사의 제품인 '질맥스(Zilmax)'가 안전하다는 것을 증명하기를 원하고 있음. 하지만 여기에는 카길(사)(Cargill Inc.)와 같은 대형 육가공업체가 동물용 의약품을 건드리는 것을 원치 않고 있음.  머크(사)는 지난 8월 미국과 캐나다엥서 동물의 비육을 목적으로 한 의약품의 판매가 중단된 이래로 이 동물용 의약품의 재도입을 위해 거대한 검사 계획을 세우고 있음. 검사대상 무리의 규모는 현재 약 5억만 달러치의 가치가 있음. 하지만 사료로트(feedlot) 소유주는 질맥스를 먹인 동물을 도축업자들이 계속해서 구매할 의사가 있는지 여부가 보장되기 전까지는 이번 연구에 참여하기를 망설이고 있음. 세계 최대이자 쇠고기 가공업체의 양대산맥인 카길(사)(Cargill Inc.)와 타이슨 푸드(사)(Tyson Foods Inc.)는 질맥스를 먹인 소에게 절뚝거림 현상이 보고된 이후, 지난 가을부터 이를 취급하는 것을 중단한 질맥스에 대한 입장에는 변화가 없음을 본지(Reuters)에 밝힘. 두 업체는 미국 쇠고기 가공 분야의 37%를 차지하고 있음. 본지는 지난 12월 타이슨 푸드(사)가 질맥스를 먹인 가축을 수용하는 것을 중단했다고 보도했음.쇠고기 가공업체들은 머크(사)가 과학적으로 질맥스가 동물에게 안전하다는 것을 증명할 때까지 이를 금지하겠다고 언급했음.  머크(사)는 12월, 첫 분기에 질맥스에 대한 평가를 시작했다고 전했음. 하지만 이번주 업체 대변인은 240,000 마리의 젖소가 미국 어느 지역에서 유래한 것인지, 테스트를 시작했던 것인지, 도축 전 가축들을 사육하고 비육하게 만드는 사료로트 업체, 혹은 목장주와 포장시설에 등록을 했는지 여부를 밝히기를 거부했음. 대변인은 현 계획상 몇 달간 현장검사에 참여하게 위해 미국 전역 73,000개 이상의 사료로트 중에서 적어도 50개 사료로트를 등록하는 것이었다고 전함. 또한 젖소의 가공에 동의한 각 도축장에 해당하는 5개 에서 15개 사료로트가 등록하기를 바란다고 전함."
5,유럽식품안전청이 프로피온산과 관련된 안전성 재평가에서 어떤 결론을 내렸나요?,"유럽식품안전청은 프로피온산과 관련하여 유전독성 및 발암성에 대한 우려가 없으며, 현재 승인된 용도와 수준으로 사용된다면 안전성 우려가 제기되지 않는다고 결론지었습니다.","유럽식품안전청, 프로피온산, 프로피온산나트륨, 프로피온산칼슘, 피로피온산칼륨 안전성 재평가 의견 발표 유럽식품안전청의 식품첨가물 및 식품에 첨가하는 영양소 패널(ANS)은 프로피온산(E 280), 프로피온산나트륨(E 281), 프로피온산칼슘(E 282), 피로피온산칼륨(E 283)에 대한 안전성 재평가 의견을 발표함.  - 유전독성 및 발암성에 대한 우려 없음. - 프로피온산을 식품첨가물로 사용할 때 평균 및 95th percentile 식이노출치는 각각 0.7-21.1 mg/kg bw/day, 3.6-40.8 mg/kg bw/day임.- 현재 식품 첨가물로서 승인된 용도와 수준으로 사용된다면 안전성 우려가 제기되지 않음.  * 의견 전문: http://www.efsa.europa.eu/en/efsajournal/doc/3779.pdf"
6,파나마병을 야기하는 곰팡이 균주 TR4가 미국 바나나 공급에 어떤 영향을 미치고 있나요?,"TR4 균주는 미국의 과일 공급을 심각하게 위협하고 있으며, 캐번디시 바나나 품종이 전멸되어 가고 있습니다.","미국, 바나나를 위협하는 곰팡이균의 확산 심각해 세계의 바나나 상품을 위협에 빠뜨리는 곰팡이 균주의 확산으로 인해 바나나 식품망이 위기에 처했음. 1989년 최초로 파나마병(Panama disease)을 야기하는 곰팡이 균주(TR4)를 발견한 플로리다 주립대학 식물병리학 교수 랜디 플뢰츠는 라틴아메리카 생산자와 미국의 과일공급을 심각하게 위협하기 시작할 것이라고 전하며 아주 심각한 상황이라고 말했음. 그는 본 방송사(CNBC)와의 인터뷰를 통해 이 시점에 곰팡이 균주의 확산을 저지시킬 방도가 없다고 말했음.1,000여 품종의 바나나 중 세계 과일군의 45%를 차지하는 것은 캐번디시 바나나 품종으로 미국 내 슈퍼마켓에서도 흔히 발견할 수 있음.캐번디시 바나나는 파나마병을 야기하는 균주에 내성이 있음이 발견된 이래로 1950년대 인기 품종으로 부상했음. 현재 해외 바나나 수출시장의 약 95%를 차지하는 캐번디시 바나나 품종은 플뢰츠 교수가 발견한 곰팽이균주로 인해 전멸되어 가고 있음. 이 균주는 아시아, 중동, 아프리카의 바나나 작물에 타격을 주었으며 이것이 미국 중남부 지역으로 확산될지 여부가 우려되고 있음. UN 식량농업기구(FAO)에 따르면 바나나 재배국들은 모니터링, 보고, 예방을 강화할 것을 경고했고 그 문제는 더욱 악화되었다고함"
7,미국 동식물검역국이 멕시코 소로나주를 열진드기 청정지역으로 승인하려는 이유는 무엇인가?,소노라산 소와 반추류의 수입에 관한 규제를 없애고 반추류 수입업자와 수출업자의 진드기 침지와 관련된 비용을 절감시키기 위함이다.,"미국 동식물검역국, 멕시코 소로나주 열진드기 청정지역 승인안 발표 미국 동식물검역국(APHIS)은 멕시코 소로나주를 열진드기 청정지역으로 승인할 것을 제안을 함.  당국은 미국의 통관 적격 요건으로 소로나에서 유래한 소와 그 밖의 반추류에 현재 적용되는 진드기 구충제 침지 처리 요건과 침지와 관련된 문서화요건의 면제 또한 마련함. 개정안은 더 이상 불필요하다고 간주되는 소노라산 소와 반추류의 수입에 관한 규제를 없애고 반추류 수입업자와 수출업자의 진드기 침지와 관련된 비용을 절감시킬 것임. 당국은 2014년 9월 15일까지 수렴된 의견을 고려할 것임."
8,Mountain View Organic Dairy의 목욕용 우유는 언제 회수되었나요?,2014년 12월 12일에 회수되었습니다.,"[회수]호주 Mountain View Organic Dairy, 유해 병원균 함유 가능성으로 목욕용 우유 회수 *12일자 경쟁소비자위원회(ACCC) 안내문으로 기수집한 정보  - 회수일시: 2014.12.12- 유통지역: 빅토리아주 (*상세 거래처명은 원문 참조)- 제품명: Organic Bath Milk (목욕용 비저온살균 생유, 1리터 또는 2리터 포장, 화장품으로 판매, 식용 부적합 표시, 유통기한 181214)- 회수사: Mountain View Organic Dairy- 회수사유: 유해 병원균 함유 가능성"
9,카프리 썬 주스제품의 포장 시스템에 어떤 변화가 있었나요?,"카프리 썬은 포장 시스템에 큰 변화를 주었으며, 이번 달 새로 출시된 파우치에는 깨끗한 내용물을 확인할 수 있게 되었습니다.","미국, 카프리 썬 주스제품에서 곰팡이 발견 미국 위스콘신주에 뉴 베를린에 거주하는 한 소비자 수잔 호그(Suzanne Hogue)는 그녀의 5살 난 아들의 주스박스 제품에서 곰팡이를 발견했다고 본 방송사(FOX6′s Contact 6)에 알렸음. 그녀는 아들에게 줄 주스를 컵에 따랐는데 컵 안에 내용물은 갈색의 검고, 녹색을 띄었다고 함. 전문가는 주스박스에서의 곰팡이 성장은 아마 공기 중에 노출되어 일어날 수 있는 현상이라고 말했음. 미국 전역에 걸친 소비자들이 주스박스와 파우치 제품에서 곰팡이를 발견한 것과 관련해 항의하고 있지만 업체는 포장과정이 문제라고 지적하면서 브랜드 자체는 문제되지 않는다고 함. 크라프트(Kraft)(사)의 카프리 썬(Capri Sun)은 포장 시스템에 큰 변화를 주고 있음. 이번달 새로 출시된 새로운 파우치에는 깨끗한 내용물을 확인할 수 있을 것임. 카프리 썬 웹사이트에 올라오는 가장 빈번한 질문은 ""곰팡이 때문에 이러한 변화를 준 것인가?"" 였음.이에 카프리 썬은 ""우리는 여러가지 이유로 포장시스템에 변화를 주었다. 미국의 어머니 소비자들은 합성 보존료·착향제·향미료가 첨가되지 않은 카프리 썬 주스음료를 좋아한다고 말하고 있다. 하지만 그들은 파우치의 내용물을 보기를 원한다. 어린이들이 좋아하는 카프리 썬이 좋은 성분만 함유하고 있다는 것을 무(無)침전물로써 쉽게 확인할수 있을 것이다.""라고 답변했음."
10,ZMapp 실험 약품 투여 후 켄트 브랜틀리의 상태는 어떻게 변했나요?,브랜틀리는 걸을 수 있게 되었습니다.,"미국, 에볼라 바이러스 감염환자 2명.. 실험약물 투여 후 증세 호전 에볼라 바이러스에 감염되었다고 보도된 켄트 브랜틀리(Kent Brantley)와 낸시 라이트볼(Nancy Writebol)의 증세가 'ZMapp'이라는 실험 약품이 투여된 뒤 호전되고 있음. 아틀란타 에모리 대학병원에서 치료를 받고 있는 브랜틀리는 걸을 수 있게 되었으며, 라이트볼은 화요일(5일) 아틀란타에 당도할 예정이라고 함. 7월 22일, 브랜틀리는 열병 증세를 겪기 시작했으며, 라이트볼의 증세는 3일 뒤 시작되었음. 원조기관인 '사마리안의 지갑(Samaritan's Purse)'에서 구호활동을 벌이던 이들은 라이베리아 지역의 다른 의료종사자와의 접촉을 통해 감염된 것으로 여겨짐."
11,랜초피딩(사)의 유해 소고기가 판매된 패스트푸드점은 어디인가?,해당 문서에 없음,"미국, 패스트푸드점에서 렌초피딩(사)의 유해 소고기 판매했을 가능성 있어 'Press Democrat'지에 따르면 최근 회수 조치된 랜초피딩(사)의 유해 소고기가 잭인더박스(Jack in the Box) 등 패스트푸드점에 판매돼 햄버거 재료로 사용됐을 가능성이 있음.  감독관은 해당 소고기가 판매됐을 것으로 보고있음. 35개 주 약 6,000여개 소매점이 회수 명단에 기재됐음. 그러나 레스토랑 등 외식 업체는 확인되지 않고 있음. 이번 회수 제품과 관련하여 어떠한 질병도 보고된 것은 없음. 많은 패스트푸드점들이 쇠고기를 대상으로 대장균 0157:H7 같은 미생물 검사는 실시하고 있지만 암 같은 질병 여부는 확인할 수 없음."
12,Cuisinart® 전기훈제기기의 회수 사유는 무엇인가요?,제품 사용 시 가스가 문이 열릴 정도로 차는 사례가 10건 있어 예방조치 차원에서 회수함. 상해 보고는 없었음.,"[추가회수]캐나다 Canadian Tire Corporation, Limited., 안전 우려로 훈제용 가전기기 회수(중국산) - 회수일시: 2014.10.6- 유통지역: 전국 Canadian Tire 상점- 제품명: Cuisinart® 전기훈제기기(중국산, 제품번호: 85-1153)- 회수사: Canadian Tire Corporation, Limited.(수입업체)- 기타: 해당 제품은 2012년 2월부터 2014년 9월 기간동안 판매되었음. 제품 사용시 가스가 문이 열릴정도로 찬다는 10건의 소비자 사례가 있어 예방조치 차원에서 회수함. 상해 보고는 없었음. 캐나다 연방보건부는 이 가전기기와 관련된 2건의 소비자 사례 보고서를 접수받은 바 있으나 상해건은 보고된 바 없음. 회수량은 약 9,238개로 추정됨.- 제품사진: 원문 참고"
13,전직 웨스트 버지니아 의원 내외가 사망한 원인은 무엇인가?,상한 미트로프를 먹고 식중독 증세를 보여 사망했다고 소송이 제기되었음.,"미국 웨스트 버지니아 의원 내외 유가족, ""사인은 상한 고기"" 음식점 제소 전직 미국 웨스트 버지니아 의원 내외가 한 음식점에서 상한 미트로프(*곱게 다진 고기, 양파 등을 함께 섞어 빵 모양으로 만든 뒤 오븐에 구운 것)을 먹어 사망했다며 소송이 제기되었음.  전직 스타처 의원의 유가족은 지난달 음식점 '밥 에반스 팜'을 상대로 한 소송장을 잭슨 카운티 순회법원에 제출했음. 이에 업체 대변인은 본 사건에 강력 변호하겠다고 밝혔음.  소장에 따르면, 의원 내외는 지난 2012년 10월, 밥 에반스에서 미트로프를 먹은지 9시간이 흐른 뒤 식중독 증세를 보여 앰뷸런스로 병원에 이송되었음. 남편 해롤드 스타처씨는 같은 날 뇌졸증이 생겼으며 이후 2013년 12월 심장판막 개복술을 받고 4월까지 입원한 후 다음 달에 향년 84년의 나이로 사망함. 지병이 있었던 버지니아 스타처 의원은 2012년 12월에 숨졌음."
14,푸드본 시카고 앱은 어떤 정보를 분석하여 식중독 사례를 확인하나요?,푸드본 시카고 앱은 시카고와 그 인근에서 발생한 식중독 증세와 관련이 있다고 추정되는 트위트 정보를 확인하는 알고리즘을 사용합니다.,"미국 시카고, 트위터를 통해 식중독 원인 확인하기 위한 앱 개발 시카고 공중보건부 소속의 베카라 슈케어(Bechara Choucair)박사는 지역에서 발생한 식중독 일화에 대해 불평하는 트위터 사용자들을 보았을 때, 이들에게 연락을 취했고, 대개는 결국 혐의가 있는 식당의 위반사항에 의구심을 갖기도 했음. 슈케어 박사는 ""지역 여러 곳에 분포되어 있는 대부분의 식품 매개 식중독 사례를 보건부에 보고하는 것이 계속될 것을 알고 있다. 식중독에 걸린 사람들이 의사에게 연락을 취하지는 않지만 트위터에 접속해 바깥에서 먹은 음식으로 인해 식중독에 걸렸다는 사실을 전 세계에 알릴지도 모른다는 점을 깨달았다.""라고 전했음. 슈케어 박사와 동료들은 시카고에서 발생하는 신규 식중독 사례를 밝혀낼 혁신적인 방법이 있을까에 대해 궁금해했고, 스마트 시카고(Smart Chicago)라 칭하는 기술 협력 단체를 모집했음. 슈케어 박사는 스마트 시카고 협력단체가 시카고 인근에서 식품으로 인한 질병을 참고할 수 있는 수백에서 수천건의 트위트 정보를 매일 샅샅이 검토하는 앱(app) 개발을 도왔다고 전했음. 푸드본 시카고(Foodborne Chicago)라 불리는 이 앱은 시카고와 그 인근에서 발생한 식중독 증세와 관련이 있다고 추정되는 트위트 정보를 확인하는 알고리즘을 사용함. 푸드본 시카고는 'foodbornechi'로 트위터 메시지를 보내면 됨."
15,앤드류 버탈리씨가 대마씨를 빵에 넣고 싶어하는 이유는 무엇인가?,"대마는 단백질이 많고, 오메가 3, 6, 9이 풍부해 훌륭한 종자이자 곡물이기 때문이다.","호주 자영업자, 식용 대마 산업 합법화 재촉 호주 빅토리아주 중앙의 한 제빵업체가 대마씨를 빵에 넣고 싶다는 의사를 밝히면서, 대마의 식용 합법화 논란에 다시 불이 붙었음.  호주뉴질랜드 식품기준청은 식품 중 대마 사용은 안전하다는 입장을 밝혔지만 관련 법률은 현재까지도 식용을 금지하고 있는 상황임.  빅토리아주 버낼라 지역에서 '알파인 브래드' 가게를 운영 중인 앤드류 버탈리씨는 유명 슈퍼마켓과 건강식품점에 건강빵을 납품하고 있음. 그는 ""대마는 단백질도 많고, 오메가 3, 6, 9이 풍부해 훌륭한 종자이자 곡물이다""라고 말했음.  산업용 대마에는 마약인 마리화나에도 있는 향정신성 성분인 THC가 미량 함유되어 있음. 이에 버탈리씨는 ""사람들이 산업용 대마를 마약과 혼동한 탓에 건강에 좋다는 사실을 이해하지 못하고 있다""고 말했음."
16,영국소매협회(BRC)가 마련한 알레르겐 관리 지침은 어떤 주제에 초점을 맞추고 있나요?,"지침은 위해 평가법, 재료 정보 파악, 알레르겐 구분, 생산 계획 방법, 청결 관리 방법의 다섯 가지 주제에 초점을 맞추고 있습니다.","영국, 식품 제조업체 위한 알레르겐 관리 지침  새로운 식품 알레르겐 관리와 표시 규정이 올해 말, 시행됨에 따라 제조업체와 관련자들이 시급히 대비하지 않으면 식품기준청(FSA)의 '식품경보' 발령 건수가 증가할 것으로 보임.  지난 해, FSA가 식품경보를 발령한 주요 이유 중에는 알레르겐 교차오염과 표시 오류가 있었음. EU의 소비자식품정보규정(FIR)에 따라 올해 말에 시행될 새로운 규정에 대한 혼란으로 업체들이 제대로 준비하지 않으면 식품경보 수가 더 늘어날 것임. 업체들이 변화에 대처하도록 돕기 위해, 영국소매협회(BRC)가 알레르겐 사용 관리에 관한 지침을 마련했음. 지침은 다음 다섯 가지 주제에 초점을 맞춘 것임. 1. 필요한 관리조치를 결정하기 위해 정확한 위해 평가법으로 공정과정, 활동, 성분의 위해도를 평가하도록 함.  2. 공급업체로부터 시설에 전달되는 재료에 대한 정보를 충분히 파악하여 알레르겐을 적절히 관리할 수 있어야 함.3. 알레르겐 관리 과정의 핵심 절차로서 알레르겐을 적절히 구분해야 함.4. 지침에는 교차오염을 줄일 수 있는 생산 계획 방법을 제시하고 있음.5. 교차오염을 없애거나 줄이기 위한 청결 관리 방법을 제시하고 있음.   *BRC 알레르겐 표시 참고 지침 전문: http://www.brc.org.uk/downloads/Guidance%20on%20Allergen%20Labelling.pdf"
17,뉴욕시 소비자 문제 및 보호 위원회가 가결한 법안은 무엇을 요구하나요?,유전자 변형(GMO) 식품에 라벨을 요구하는 법안(A.3525)을 가결했습니다.,"미국 소비자연맹, GMO 라벨 법안 뉴욕시 소비자문제 위원회 가결 발표 미국 소비자연뱅은 뉴욕의회의 '소비자 문제 및 보호 위원회(Committee on Consumer Affairs and Protection)'가 유전자 변형(GMO)식품 라벨을 요구하는 법안(A.3525)을 찬성 9표로 가결시켰음을 발표함. 특수 법인 이해관계자들의 상당한 로비에도 불구하고 집회 및 직접적인 제정 소통을 포함한 환경 및 소비자단체의 강력한 조직화가 법안이 위원회를 통과하는데 도움을 주었음. 법안 상정자이자 위원회 회원인 린다 로젠탈(Linda B. Rosenthal)은 몇 달에 걸친 노력과 위원회에서 법안을 부결시키려는 업계 로비스트들의 노력에도 불구하고 소비자 문제 위원회를 성공적으로 통과한 GMO 법안에 만족한다고 말했음. 그녀는 대부분의 수 많은 뉴욕인들이 그들의 가족이 섭취하는 식품에 무엇이 있는지를 알기를 원한다며 오늘 뉴욕시는 GMO 라벨 의무화를 실현시키는데 한 발 다가갔다고 밝혔음.  이번 법안은 식품에 무엇이 들었는지, 어떻게 만들어졌는지에 관한 기본정보를 소비자들에게 제공하는 유전자 변형(genetic engineering) 기술로 생산된 식품의 라벨을 요구함. 이로써 식품을 선택하는데 있어 소비자들에게 정보를 제공하게 될 것임. 현재는 식품 제조업자에게 유전자 변형(GM)된 식품에 라벨을 할 것을 요구하는 규정은 없음."
18,"Baptista's Bakery, Inc가 회수한 프레즐의 제품명은 무엇인가요?","Houdini, 3 oz Honey Mustard Pretzel Nuggets","[E/R]미국 Baptista's Bakery, Inc, 알레르기 유발성분인 유청 미표시한 프레즐 회수 -지역: 미국 캘리포니아 -제품명: Houdini, 3 oz Honey Mustard Pretzel Nuggets, 품목 # COM 562 로트 30014 -회수사: Baptista's Bakery, Inc (회수종료, 회수일 2014-11-14)-회수사유: 제품에는 표시하지 않은 유청이 함유된 조미료를 잘못 사용"
19,린다 로젠탈 뉴욕 의원이 상정할 예정인 법안의 주요 내용은 무엇인가?,뉴욕의 모든 식품에 유전자 변형 생물체(GMO) 표시를 부착하도록 요구하는 법안이다.,"미국 뉴욕주 의원, GMO 표시안 상정할 예정  뉴욕 주의 한 의원이 뉴욕의 모든 식품에 유전자 변형 생물체(GMO) 표시를 부착하도록 요구하는 법안을 상정할 계획임. 일부 반대 시각에서는 GMO 식품을 '프랑켄 식품(franken-foods)'이라고 칭함. 대두나 옥수수 시럽을 만든 것은 대부분이 유전자 변형되었을 가능성이 있음. 많은 식품에는 이미 '유기농', '전 성분 천연', 무글루텐'과 같은 라벨을 표시하고 있으나 뉴욕에서는 'GMO' 라벨을 찾아볼 수 없음. 린다 로젠탈 뉴욕 의원은 유전자 변형된 작물은 제초제가 아주 많이 뿌려져도 견딜 수 있다면서 소비자를 보호하기 위해  GMO 표시를 요구하는 안을 상정할 예정이라고 전했음."
