id,질문,정답,top1 문서
758,METALLISK 에스프레소 메이커의 회수 사유는 무엇인가요?,파열로 뜨거운 내용물이 나와 소비자에게 화상 및 기타 부상 위험을 초래할 수 있음,"[회수] 싱가포르 IKEA, 제품 사용 중 파열 위험 증대로 메탈리스크 에스프레소 메이커 회수  - 발생일자 : 2022.6.8- 제품명 : METALLISK espresso maker for hob 0.4 (은색, 회색 색상의 스테인리스 스틸 안전 밸브가 있는 제품)- 회수사 : IKEA- 원산지: -- 회수사유 : 사용 중 제품이 파열될 위험 증대- 제품사진 : 원문 참조- 기타: 관련하여 보고된 사고 사례가 없으며, 다른 유닛의 제품은 동 회수의 영향을 받지 않음."
759,미국 식품안전검사국이 중국산 육류 및 가금류 제품에 대해 공중보건경보를 발령한 이유는 무엇인가?,미국 식품안전검사국은 부적격 육류 및 가금류 제품이 수입재검사를 위해 제출되지 않았음을 확인하여 공중보건경보를 발령하였다.,"미국 식품안전검사국, 중국산 부적합 수입 육류 및 가금류 제품에 대한 공중보건경보 발령(제품 추가3)  * 기수집정보:1) 미국 식품안전검사국, 중국산 부적합 수입 육류 및 가금류 제품에 대한 공중보건경보 발령(수집일자: 2021-12-30)2) 미국 식품안전검사국, 중국산 부적합 수입 육류 및 가금류 제품에 대한 공중보건경보 발령(제품 추가) (1/4)(수집일자: 2022-02-05)3) 미국 식품안전검사국, 중국산 부적합 수입 육류 및 가금류 제품에 대한 공중보건경보 발령(제품 추가) (2/4)(수집일자: 2022-02-05)4) 미국 식품안전검사국, 중국산 부적합 수입 육류 및 가금류 제품에 대한 공중보건경보 발령(제품 추가) (3/4)(수집일자: 2022-02-05)5) 미국 식품안전검사국, 중국산 부적합 수입 육류 및 가금류 제품에 대한 공중보건경보 발령(제품 추가) (4/4)(수집일자: 2022-02-05)6) 미국 식품안전검사국, 중국산 부적합 수입 육류 및 가금류 제품에 대한 공중보건경보 발령(제품 추가2) (1/2)(수집일자: 2022-02-09)7) 미국 식품안전검사국, 중국산 부적합 수입 육류 및 가금류 제품에 대한 공중보건경보 발령(제품 추가2) (2/2)(수집일자: 2022-02-09) 미국 식품안전검사국(FSIS)은 추가 조사에서 부적격 육류 및 가금류 공급원으로 생산되고 수입재검사를 위해 FSIS에 제출하지 않은 추가 육류 및 가금류 제품을 확인하였음. - 제품목록(사진포함): https://www.fsis.usda.gov/sites/default/files/food_label_pdf/2022-02/pha-12292021-01-product-list_3.pdf 추가된 제품 목록은 다음과 같음. 1) Bestore Meat Floss Cake. UPC Code: 6932588595057; Immediate Packaging UPC Code: 6932588596962 2) Youchen Meat Floss Cake Spicy. UPC Code: 6958620700562; Immediate Packaging UPC Code: N/A3) Qing Ni Chicken Feet with pickled peppers. UPC Code: 6971028280023; Immediate Packaging UPC Code: 69710282800164) Chinese Dimdouduk Cantonese Style Sausage and Bacon Gift. UPC Code: N/A; Immediate Packaging UPC Code: 69712368806195) Youchen Meat Floss Cake. UPC Code: N/A; Immediate Packaging UPC Code: 69586207000366) Pork Belly. UPC Code: N/A; Immediate Packaging UPC Code: 69731063515647) Puly Goose Grease w/ Scallions. UPC Code: N/A; Immediate Packaging UPC Code: 47170114732308) Dr. Diary Goose's Grease w Chili. UPC Code: 04717011472356; Immediate Packaging UPC Code: 47170114723569) Shoo Loong Kan Hot Spicy Luncheon Meat. UPC Code: 6971013103023; Immediate Packaging UPC Code: 697101310311510) Goose's Grease with Shallots. UPC Code: 04710813007733; Immediate Packaging UPC Code: 471081300773311) Puly Goose's Grease with Chili. UPC Code: N/A; Immediate Packaging UPC Code: 471701147322312) Mushroom Chicken Rice Pot. UPC Code: N/A; Immediate Packaging UPC Code: 6971415833511  (*) 수집일자(02/14) 확인 시 공중보건경보 제품이 추가되었으나, FSIS 홈페이지의 정보 업데이트 날짜는 변경되지 않고 2월 7일로 그대로 기재되어 있어 발생일자와 수집일자 차이가 발생하였음."
760,METALLISK 에스프레소 메이커의 회수 사유는 무엇인가요?,폭발 및 뜨거운 내용물 배출로 인한 화상 및 부상 위험 때문입니다.,"[회수] 싱가포르 IKEA, 제품 사용 중 파열 위험 증대로 메탈리스크 에스프레소 메이커 회수  - 발생일자 : 2022.6.8- 제품명 : METALLISK espresso maker for hob 0.4 (은색, 회색 색상의 스테인리스 스틸 안전 밸브가 있는 제품)- 회수사 : IKEA- 원산지: -- 회수사유 : 사용 중 제품이 파열될 위험 증대- 제품사진 : 원문 참조- 기타: 관련하여 보고된 사고 사례가 없으며, 다른 유닛의 제품은 동 회수의 영향을 받지 않음."
761,Kraft Heinz가 회수하는 Capri Sun Wild Cherry Flavored Juice Drink Blend의 회수 사유는 무엇인가요?,식품가공 장비에 사용되는 희석된 세척용액이 부주의로 인해 생산라인에 들어가게 되었기 때문입니다.,"[회수]미국 Kraft Heinz, 생산라인의 세척용액 문제로 음료류 회수 -일자: 2022.08.15.-유통지역: 미국(*상세 지역은 언급되지 않음)-회수사: Kraft Heinz-제품명: Capri Sun Wild Cherry Flavored Juice Drink Blend. 6.6 FL OZ. 판지 상자에 개별포장된 파우치가 들어있음. > Best When Used By: June 25, 2023. > 파우치 코드: 25JUN2023 WXX LYY ####. (####: 0733-0900, XX: 01, 02, 03, 04, 09, 10일 수 있음. YY: 01 - 12일 수 있음.) > 상자 코드: 25JUN2023 WXX #### CT1404. (####: 0733-1000, XX: 01, 02, 03일 수 있음.)> Carton UPC: 0 8768400100 4. > Case UPC: 87684 00409 00.-회수사유: 식품가공 장비에 사용되는 희석된 세척용액이 부주의로 인해 생산라인에 들어가게 되었음.-기타: 회수사는 제품의 맛과 관련하여 다수의 소비자 불만을 접수했음."
762,Fresh Express가 샐러드 제품 회수를 발표한 날짜는 언제인가요?,12월 20일입니다.,"[회수]미국 Fresh Express Incorporated, 리스테리아 오염 가능성으로 샐러드볼 자발적 회수 -일자: 2024-10-26(FDA 발표일: 2024-10-26)-유통지역: 미국 CA, LA, TX, WA-회수사: Fresh Express Incorporated-브랜드명: Gourmet Cafe-제품명: Fresh Express Gourmet Café Chicken Caesar(5.75 oz; UPC: 071279565620;Package Code: S281, S282, S285, S288;Use-By-Date: 10/26/2024, 10/27/2024, 10/30/2024, 11/2/2024)-회수사유: 리스테리아 오염 가능성-제품사진: 원문참조-기타: 제품에 리스테리아 오염 가능성으로 회수된 외부 식재료 공급업체인 BrucePac의 닭고기 제품이 포함되었음. 동 회수에 신선 채소는 영향을 받지 않음."
763,뉴질랜드 맥도날드에서 McBites 메뉴 품목이 회수된 이유는 무엇인가요?,생산 시 제품 크기 규격 이탈로 인해 조리되지 않은 상태로 제공되었기 때문입니다.,"[회수]뉴질랜드 맥도날드, 생산 시 제품 크기 규격 이탈하여 조리되지 않은 치킨 너겟 회수 - 일자: 2022.05.20.- 유통지역: 뉴질랜드 전역- 회수사: McDonald’s NZ- 제품명: McBites 메뉴 품목(McBites menu item)- 회수사유: 생산시 제품 크기 규격 이탈(조리되지 않음)- 기타: 뉴질랜드 티마루(Timaru)의 맥도날드(McDonald)의 조리되지 않은 닭고기에 대한 불만으로 뉴질랜드 전역에서 McBites 메뉴 품목에 대한 회수가 일어났으며 일차산업부(MPI)가 조사를 확인했음. 맥도날드는 날 제품의 문제는 음식점에서의 인적 오류가 아니라 생산 문제였다고 함. 약 일주일 전, Keegan Mackway-jones는 소셜 미디어에 사진 3장과 ""티마루의 맥도날드는 오늘 저녁 내 닭고기를 내가 조리해야만 했다는 것을 알지 못했다""라는 설명으로 고객들에게 경고하는 게시글을 올렸음. 맥도날드 NZ의 대변인인 시몬 케니는 Timaru 지점은 즉시 날 제품 불만을 조사하였고, 이에는 사건을 본사로 전달하는 것도 포함되었다고 The Timaru Herald에 말했음.""McDonald's는 공급업체와 협력하여 문제의 원인이 음식점에서의 인적 오류가 아니라 생산 시 잘못된 제품 크기 규격(specification)임을 확인했습니다."" 케니는 일부 McBites가 크기 규격을 벗어남을 의미한다고 함.""공급업체의 조사에 따르면 배치의 일부 McBites는 빵가루가 묻혀지기 전에 서로 붙어 있었다. 각 제품은 제품 규격에 따라 특정 조리 시간이 있다""  ""충분한 주의 속에서, 맥도날드는 전국적으로 제품 판매를 중단하였고 대체품을 유통하였다"" MPI 대변인은 NZ Food Safety가 불만 사항을 접수했으며 조사 중이라고 함."
764,Beyond Meat 공장에서 리스테리아균이 검출된 시기는 언제인가?,2021년 하반기와 올 상반기에 최소 11번 검출되었다.,"남아프리카 RCL Foods(사), 육류 가공공장에서 리스테리아 확인되지 않았다 남아프리카 'RCL Foods(사)'는 금요일(현지 시간), 육류 가공공장에서 실시한 외부 검사시험에서 리스테리아에 대한 어떠한 흔적도 발견되지 않았다고 밝혔음. 보건 당국은 약 2주 전, 작년 1월부터 남아프리카 공화국에서 180여 명의 사망자를 발생시킨 리스테리아 집단 식중독의 원인이 'Tiger Brands'와 'RCL Foods'가 제조한 폴로니(polony)라는 가공육으로 밝혀지자 회수를 지시했음. 정부는 'Tiger Brands'가 소유한 한 공장에서 식중독 원인 균주 계통을 찾아냈고, 'RCL Foods'의 'Wolwehoek' 공장 역시 조사하고 있었음. 하지만, 'RCL Foods(사)'는 이 분야에 정통한 전문가로 알려져 있는 프랑스 소재의 한 외부 실험실이 진행한 검사에서 'ST6' 리스테리아 계통이 자사 공장에 존재하지 않는다고 밝혀진 사실을 성명을 통해 전했음. 남아프리카 당국은 'Tiger Brands'의 두 번째 공장도 조사 중이라고 밝혔지만 'RCL Foods(사)' 공장 검사 완료 시기는 언급하지 않았음."
765,MannaMilk의 소유주는 누구인가?,John Albert Martin,"뉴질랜드 일차산업부, 원유 불법 판매로 MannaMilk(사)에 벌금 $30,000 부과 뉴질랜드 호로훼누아 우유 업체인 MannaMilk(사)는 원유 공급 및 판매를 규제하는 규정을 준수하지 않아 벌금 $30,000를 부과 받았음. 뉴질랜드 식품안전부의 성공적인 기소에 따라, MannaMilk 소유주인 John Albert Martin는 Levin 지방 법원에서 오늘 선고를 받았음. 앞서 Martin은 원유 규정 미준수, 원유 판매, 원유 가공 및 판매 중단 통보 지시 미준수를 포함여 동물성 제품법(Animal Products Act)에 따른 3가지 혐의에 대해 유죄를 인정했음."
766,미국 식품안전검사국이 추가로 확인한 부적격 육류 및 가금류 제품은 무엇인가?,"Yu Yu Chicken Legs, Dr. Diary’s Goose’s Grease, Kung Fu Sauce Goose Grease with Shallots","미국 식품안전검사국, 중국산 부적합 수입 육류 및 가금류 제품에 대한 공중보건경보 발령(제품 추가15) 미국 식품안전검사국(FSIS)은 추가 조사에서 부적격 육류 및 가금류 공급원으로 생산되고 수입재검사를 위해 FSIS에 제출하지 않은 추가 육류 및 가금류 제품을 확인하였음.  - 제품목록(사진포함): https://www.fsis.usda.gov/sites/default/files/food_label_pdf/2022-04/updated_PHA-12292021-Product-List-Part-2_.pdf 추가된 제품 목록은 다음과 같으며 PDF 파일 Part 2가 새로이 업로드 되었으며, 추가된 제품은 PDF 파일 24~26 페이지 제품임 1) Nantong Xianpia Duck Neck (pink/black label) - Spicy flavor, Shipping Container UPC Code: none. Immediate Packaging UPC Code: 69721584612142) Tianjiao Spicy Beef, Shipping Container UPC Code: N/A, Immediate Packaging UPC Code: 69536018003163) Xianli Hizhou Style E Braised Chicken Wings, Shipping Container UPC Code: N/A, Immediate Packaging UPC Code: 6974466960151"
767,BASF의 유전자변형 LBFLFK 카놀라 오일은 식품용으로 안전한가?,"BASF의 결론에 따르면, LBFLFK 카놀라에서 추출한 오일은 식품용으로 안전하다.","미국 식품의약품청, 조성 변화 및 제초제 저항성 유전자변형 카놀라 자문 완료(2) 미국 식품의약품청(FDA)은 BASF Plant Science, L.P.의 유전자변형 LBFLFK 카놀라에 대한 자문을 완료하였음. 동 카놀라는 조성 변화(유지 - 특정 장쇄 다중불포화 지방산 생성)와 제초제에 저항성(이미다졸리논)을 갖도록 유전자변형된 것임.   BASF의 결론은 다음과 같음. - LBFLFK 카놀라에서 추출한 유지(오일)는, 멘헤이든유을 포함하여, LCPUFAs를 함유하고 현재 시판 중인 다른 유지와 마찬가지로 식품용으로 안전함- 조성 변화 및 제초제 저항성 BASF 카놀라는 GRAS이며, FDA의 시판 전 검토 또는 승인이 필요한 문제를 제기하지 않음- BASF는 LBFLFK 카놀라에서 용제 추출된 박(meal)이 기존의 용제 추출된 카놀라 박과 조성, 안전성 또는 기타 관련 매개변수가 실질적으로 다르지 않을 것이며, 식용 식품에 용제 추출된 LBFLFK 카놀라 박 유래의 단백질 분리제를 사용하는 것이 FDA의 시판 전 검토 또는 승인이 필요한 문제를 제기하지 않음 (*) https://www.fda.gov/media/157177/download"
768,영국 식품기준청의 CBD 제품 공개 목록에 등재되기 위해 업체가 제출해야 하는 증거는 무엇인가?,업체는 자사의 제품이 신뢰할 수 있는 신청 건과 연계되어 있으며 2020년 2월 이전에 시장에 나왔다는 증거를 제출해야 한다.,"영국 식품기준청, CBD 제품 공개 목록에 등재 원하는 업체는 5월 26일까지 최종신청해야 *관련 기수집 정보2022-04-01 영국 식품기준청, 신소재 식품 승인 신청 후 승인단계에 가까워진 CBD 제품 목록 공개2022-04-15 영국 식품기준청, 행정적 오류로  CBD 식품 승인 목록에 누락되었던 브랜드 곧 추가될 것 영국 식품기준청(FSA)이 CBD 제품 공개 목록에 등재를 원하는 업체는 5월 26일까지 신청해야 한다고 최종 공고함.CBD 공개 목록에 있는 제품들은 FSA에 신뢰할 수 있는 승인 신청이 있음을 의미함.기업들은 5월 26일까지 자사의 제품이 신뢰할 수 있는 신청 건과 연계되어 있으며 2020년 2월 이전에 시장에 나왔다는 증거를 제출해야 함.  다음 기준을 충족하는 CBD 식품만 공개 목록에 추가될 수 있음:>CBD 관련 발표 당시(2020년 2월 13일) 시판된 상태였어야 함 >FSA가 승인 신청을 2021년 3월 31일까지 받은 제품>FSA가 신청서 유효성을 확인했거나 유효성 검사가 충분히 진행 중이라는 데 동의했어야 함 FSA는 계속해서 CBD의 신규식품 신청을 받고 있지만, 신청과 관련된 제품들은 그 절차를 완료하고 허가를 받을 때까지 판매해서는 안 됨."
769,영국 환경식품농촌부가 승인한 유전자변형 보리의 시험재배 목적은 무엇인가?,자연적으로 발생하는 토양 곰팡이와의 개선된 작물 상호작용이 보다 지속가능한 식량 생산으로 귀결될 수 있는지 여부를 평가하기 위함이다.,"영국 환경식품농촌부, 유전자변형 보리 시험재배 승인 영국 환경식품농촌부 Defra가 과학자들이 인공 비료의 필요성을 줄일 수 있다고 주장하는 유전자변형 보리의 시험재배를 승인했음. 케임브리지 작물연구소(Crop Science Centre in Cambridge) 연구진이 운영하는 동 실험은 자연적으로 발생하는 토양 곰팡이와의 개선된 작물 상호작용이 보다 지속가능한 식량 생산으로 귀결될 수 있는지 여부를 평가할 것임. 보리 품종은 NSP2 유전자의 발현 수준을 높이기 위해 유전적으로 변형되었음. 이 유전자는 보리에 자연적으로 존재함."
770,인도 식품안전기준청이 대마씨 제품에 대해 설정한 THC 기준은 무엇인가요?,"대마씨 제품에 대한 THC 기준은 대마씨와 대마씨 분말의 경우 최대 5.0mg/kg, 대마씨 추출 기름의 경우 최대 10.0mg/kg, 대마씨로 만든 음료의 경우 0.2mg/kg입니다.","이탈리아, 대마 유래 식품에 대한 THC 제한치 및 검사 기준 설정 이탈리아가 대마 곡물로 만든 식품에 대해 THC 제한치를 설정하여 생산자들에게 제품을 시장에 출시하기 위한 '대망의' 지침을 제공함. 이탈리아 보건부는 THC 최대 수준을 다음과 같이 설정했음:- 대마(곡물)에서 파생된 가루, 씨앗 및 보충제: kg당 2mg- 대마 유래 오일: kg당 5mg 이탈리아는 1월 15일에 발표된 법령에서 제한치를 설정했음. 동 수준은 곡물에서 유래된 대마 식품에만 적용되며, CBD 또는 기타 칸나비노이드가 주입된 식품에는 적용되지 않음. CBD 식품은  유럽 연합에서 '신식품' 으로 간주됨. 이탈리아의 농민 단체는 대마 씨앗 THC 법령을 환영함. 이탈리아 독립 농민 연맹(Coldiretti)은 2013년~2018년 사이에 대마 재배가 400헥타르 (988에이커)에서 거의 4,000헥타르(9,884에이커)로 10배 증가했다고 전함. 이탈리아의 새로운 대마 법령에 따라:- 독소 샘플링은 2006년에 확립된 일련의 EU 테스트 규칙에 따라 수행해야 함- THC 샘플링은 2016년부터 시행된 EU 시험 규칙을 따름 오일에 대한 이탈리아의 THC 한도는 독일이 정한 기준과 일치하지만, 다른 식품의 경우 이탈리아의 THC 제한치가 더 높음."
771,바이든 대통령이 서명한 새로운 행정명령의 주요 목표는 무엇인가?,"새로운 행정명령의 주요 목표는 농업, 기후변화, 에너지, 식량안보, 보건 문제에 대한 혁신적인 해결책을 촉진하는 것이다.","미국 환경보호청, 바이든 대통령의 새로운 행정명령에 따라 생명공학 혁신 노력을 새롭게 해 미국 바이든 대통령은 '지속가능하고 안전하며 안정된 미국 바이오경제를 위한 생명공학 및 바이오제조 혁신의 진전' 이라는 새로운 행정명령(*)에 서명했음. 새로운 행정명령에 따라 미국 환경보호청(EPA), 농무부(USDA), 식품의약품청(FDA)은 생명공학 제품에 대한 규제절차의 명확성과 효율성을 개선하기 위한 노력을 새로이 함. 이러한 노력은 농업, 기후변화, 에너지, 식량안보, 보건 문제에 대한 혁신적인 해결책을 촉진하는 것을 목표로 함. (*) https://www.whitehouse.gov/briefing-room/presidential-actions/2022/09/12/executive-order-on-advancing-biotechnology-and-biomanufacturing-innovation-for-a-sustainable-safe-and-secure-american-bioeconomy/"
772,영국 정부가 유전자 편집 법안을 통해 기대하는 주요 효과는 무엇인가?,유전자 편집은 앞으로 10년 안에 전세계 식량안보를 획기적으로 높이고 화학비료와 살충제에 대한 의존도를 줄일 수 있을 것으로 기대된다.,"영국 정부 과학고문, 상원에 유전자편집 법안 제출... 향후 10년 내 세계 식량안보 강화 기대 영국 환경식품농촌부 과학고문 헨더슨 교수(Prof Gideon Henderson)가 유전자 편집은 앞으로 10년 안에 전세계 식량안보를 획기적으로 높이고 화학비료와 살충제에 대한 의존도를 줄일 수 있다고 함. 상원에 유전자 기술 관련 법안을 제출하기 전 헨더슨 교수는 엄격한 규제 하의 유전자변형 생물(GMO)과 유전자 편집이 다르게 취급될 수 있도록 함으로써 유전자 편집 제품 개발과 상용화를 가속화하는 더 단순한 규제 프레임워크 구축을 목표로 하고 있다고 밝힘. 그는 유전자편집이 기후 위기, 해충, 질병에 더 강한 작물 생산에서부터 세계 기아 퇴치에 도움이 될 수 있는 농작물 수확량 증가에 이르기까지 수많은 이점을 가져올 수 있다고 함. 또한 비타민 D가 풍부한 토마토와 같은 영양가가 있는 작물을 만드는데 사용될 수 있음. 식품 표시는 또 다른 문제인데 법안이 통과될 경우 잉글랜드에만 적용되어 브렉시트 이후 GMO 농산물 생산 및 판매 금지를 유지하는 스코틀랜드 및 웨일스 정부와 갈등을 빚을 수 있음."
773,영국 성인의 몇 퍼센트가 의료 목적으로 CBD 또는 대마오일을 사용한 적이 있나요?,약 20%,"영국 칸나비노이드산업협회, 성인 5분의 1이 의료 목적으로 CBD 또는 대마오일 사용한 적 있어 영국 칸나비노이드 산업협회(Association for the Cannabinoid Industry, 이하 ACI)의 설문조사에 따르면 영국 성인의 약 5분의1이 의료 목적으로 CBD 또는 대마(cannabis)오일을 사용한 적이 있다고 함. 조사 결과, CBD나 대마유를 사용한다고 응답한 남성의 비율이 18%로, 여성 14%에 비해 높게 나타났으며, 18세에서 44세 대상자의 약 4분의 1이 CBD를 사용했다고 응답하는 등 젊은 층의 인구통계가 더 민감했음.CBD 제품을 구매한 적이 있는 사람들은 온라인으로 구매했을 가능성이 가장 높았고, 38%는 인터넷 상점에서 구매했으며, 30%는 Boots, Holland  Barrett 등의 체인점에서 구매했음.응답자의 27%는 대개 건강식품점에서 이를 구매했고, 16%만이 슈퍼마켓 체인에서 구입했으며, 14%는 편의점에서 구입했음. 이번 조사는 영국의 대마 산업 성장을 위한 보다 적극적인 정부 전략을 요구해온 옥스퍼드대 크리스 호지스(Chris Hodges) 교수의 산업 검토의 일환으로 진행되었음.  검토에서 ""정부가 동 분야에 대해 취하는 비협조적이고 무관심하거나 방임적 태도는 지속가능하지 않으며 용납할 수 없다""며, ""기존 (대마) 규정은 각 제품과 관련된 위험에 대해 제대로 조정되지 않았다""고 함."
774,영국 소비자들이 식물성 단백질을 섭취하려는 주된 이유는 무엇인가?,식품 안전에 대한 확신이 주된 이유이다.,"영국, 소비자 3분의1이 배양육을,  4분의1은 식용곤충 먹어 볼 의향 있어 영국 식품기준청(FSA)의 대체 또는 새로운 단백질 공급원에 대한 소비자 인식 조사(*)에 따르면, 영국 소비자들 3분의 1은 배양육을, 4분의 1은 식용곤충 섭취를 시도할 의향이 있다고 함. 또한 10명 중 6명꼴로 이미 많은 수가 시판중인 식물성 제품을 먹어볼 의향이 있다고 밝혔음. 배양육이나 식용 곤충 섭취 권장에 있어 식품 안전이 소비자들에게 얼마나 중요한지가 이번 조사를 통해 드러남. 이미 소비자들이 식물성 단백질을 기꺼이 섭취하려는 주된 이유는 바로 식품 안전에 대한 확신임. 응답자의 90%가 식물성 단백질, 80%가 식용곤충, 78%가 배양육에 대해 들어본 적이 있을 정도로 대체 단백질에 대한 소비자 인지도가 높았음.또한 응답자 10명 중 6명은 식단에서 식물성 단백질을 섭취할 의향이 있었고, 그 이유로는 섭취해도 안전하다고 생각해서(44%), 건강상의 이유(39%) 또는 환경이나 지속가능성(36%)때문이었음. 식물성 단백질을 시도하는 데에 있어 가장 큰 장벽은 전통적인 육류에 대한 선호였음. (*) https://www.food.gov.uk/research/behaviour-and-perception/survey-of-consumer-perceptions-of-alternative-or-novel-sources-of-protein"
775,미국 식품안전센터와 국제기술평가센터가 FDA에 청원한 주요 내용은 무엇인가?,영아용 조제식 내 신규 나노물질을 규제할 것을 청원하였다.,"미국 식품안전센터 등, FDA에 영아용 조제식 내 신규 나노물질 규제할 것을 청원 미국 식품안전센터(Center for Food Safety)와 국제기술평가센터(International Center for Technology Assessment)는 미국 식품의약품청(FDA)에 영아용 조제식 내 신규 나노물질을 규제할 것을 청원하였음.  식품안전센터의 정책 이사는 ""FDA는 다수의 미국 영아용 조제식이 승인되지 않은 나노 화학 첨가물을 함유하고 있다는 것을 알고 있다""며 이러한 해로운 첨가물로부터 안전할 수 있도록 조치를 취해야 한다고 하였음. 유럽에서는 영아용 조제식에서 이러한 첨가물을 사용하지 않도록 하고 있으며, 미국 또한 그러해야 한다고 밝혔음.  유럽연합은 미국의 영아용 조제 분유에서 발견되는 수산화인회석 및 이산화티타늄과 같은 일부 화학 물질의 나노 및 벌크 형태에 대해 심각한 우려를 제기하였음. EFSA는 최근 이산화티타늄의 유전독성에 대한 우려가 있음을 발견했음. 두 센터는 청원서를 통해 FDA가 나노물질 관리에 대한 새로운 규정을 제정할 것을 촉구하였음. 동 기관들은 FDA가 나노물질의 존재 여부를 엄격하게 검사한 다음 나노기술을 사용하였음을 표시하기를 원함. 또한 FDA가 모든 현존하는 가공 나노 입자를 함유한 유아용 제조식을 오염된 제품으로 선언하고 회수 조치를 하기를 원함. 마지막으로, FDA가 유아용 제조식 내 나노물질에 대해 ""GRAS(Generally Recognized as Safe)""의 허점을 사용하는 것을 원치 않음."
